instance_id,text,IDENTITY_ATTACK,THREAT,SEVERE_TOXICITY,INSULT,PROFANITY,TOXICITY
42856,"that bitch could’ve just shut her fuckin mouth, he’s literally trying his best. ignorant ass people",0.2331515,0.13650303,0.52891463,0.7775208,0.8449782,0.9391453
508617,he sees I've figured his shitskin friend out for the cunt that he is.,0.32768643,0.016810767,0.35368225,0.7492263,0.87472564,0.9029226
524313,Nah your the most salty bitch,0.18468912,0.013113883,0.35184112,0.78565484,0.844891,0.9061063
500612,also this fucking thread has been reproduced so many fucking times.,0.028016793,0.008841781,0.35368225,0.40243408,0.9342644,0.90451443
41296,Fuck them and Alex stupid manager fire him ASAP never will be a fan,0.2308735,0.34926313,0.50703704,0.7298119,0.8255558,0.95048624
53899,"okay my juul conspiracy theory is it HAS to be lucas ,,, his hand is fucking HUGE and who has those huge fucking hands as big as heads???? lucas is the fuckiest fuck boy ever and this is just the icing on the cake ... send tweet",0.18158256,0.056240413,0.50703704,0.6677319,0.86331284,0.911035
496417,jillian please keep similar energy and shut the fuck up thank u,0.06929302,0.064969026,0.45401973,0.65865606,0.8449782,0.911035
406415,br games are fucking ass lmao,0.08749158,0.012906751,0.45895407,0.563347,0.927271,0.95048624
406420,"Seriously, fuck you, you xenophobic racist twat.",0.48915586,0.08089764,0.61260825,0.91372794,0.94929975,0.9749944
43177,Shit on this clown the other day and he wouldn’t send the chall. Waste of time.. huh you good bitch,0.15731181,0.050098058,0.45895407,0.8390655,0.89909166,0.944597
481622,i hate a “cash app in bio” bitch 😂,0.28034934,0.025098583,0.349583,0.6336687,0.83974665,0.90451443
553623,"Your lady penis horripilates with antediluvian spirits, slicking the closet in bubbling phlegm",0.2783691,0.048158366,0.45895407,0.5678696,0.70864636,0.9061063
405223,Haha bullshit. Your talking bullshit why the fuck 100 people.would be needing a reset If the service ain't got issues. But as you say the reseller can sort it 🤔🙄,0.052035484,0.021127338,0.45895407,0.5723624,0.8907955,0.9209984
46441,i fucking hate period cramps like bro FUCK YOU ITS HURTS SO MUCH I THINK IM GONNA BLACKOUT TMR MORNING LIKE HOW I ALMOST DID A FEW MONTHS AGO,0.17226285,0.34804323,0.52891463,0.5208188,0.8690192,0.9248995
428420,"I mean honestly..... Shits super stupid, not sure why you guys did it lol",0.051126,0.0104988385,0.3529199,0.6798578,0.86331284,0.9061063
546520,I will kill...my enemies...KILL THEM! 🔪🔪,0.23011416,0.86058503,0.50703704,0.31740165,0.39670458,0.9029226
561810,"OK I'm just gonna say this right now, if you fuck with my food, or I see you fuck with food in a grocery store. Imma stomp your ass. This food shit is getting out of control and this generation is fucking retarded. Not everything is a challenge, and fucking with food is illegal.",0.29035977,0.5330498,0.50703704,0.65865606,0.902047,0.91625386
561815,This guy sounds like an idiot.,0.060675595,0.00967031,0.072789766,0.8987166,0.5150164,0.9061063
56601,"On my grind like fuck a bitch, I’ll get some pussy later",0.14019285,0.13532294,0.45895407,0.5678696,0.8802007,0.9061063
566011,Go jerk off to fake tits while listening to the America Fuck Yeah song. You're a clown.,0.3043136,0.11309616,0.56375664,0.7922567,0.86331284,0.9563754
519415,Fuck the police... that is the moral of this story.,0.2839175,0.13815513,0.3536391,0.5678696,0.87472564,0.9029226
44229,Ur mum is dying so shut the fuck up n stop being a keyboard warrior,0.20088354,0.34804323,0.56375664,0.7775208,0.87472564,0.95048624
435316,"""It's not gay, I'm just peeing in his butt""",0.48915586,0.0824309,0.44787344,0.5130944,0.7888968,0.9029226
435322,What the hell. Has this dumbass bitch got a 5th grade education.,0.20483385,0.038911607,0.45895407,0.8685752,0.84995824,0.93383175
538017,“i hate kpop. bitches be like “_____” fuck you which one?”,0.37879246,0.05397744,0.50703704,0.66500133,0.92389363,0.944597
56031,It wasn't an inside job. Shut the fuck up already.,0.027614836,0.03165977,0.35368225,0.6109131,0.90258646,0.9209984
451020,yall better fucking click it whores,0.2783691,0.06270605,0.50703704,0.78882504,0.9421618,0.96069145
431413,YASS YASSSS SHE WAS. THAT. BITCH. PERIODTTTTTTTT,0.109318495,0.017846745,0.44787344,0.7218519,0.8326356,0.91625386
42966,If you agree to a system don't get buttmad when it fucks you up the arse,0.052035484,0.053007595,0.35368225,0.5130944,0.91513264,0.9209984
40146,God will take all that shit away fast but bitches not humble enough.,0.36873037,0.091630474,0.35368225,0.7782364,0.8907955,0.91625386
55878,i shall put a curse on you. you will not repair your body clock on time and you shall suffer with me. — You mf bitch,0.26833034,0.70778835,0.61260825,0.7218519,0.8255558,0.944597
43967,Fuck you all for taking a movie THIS seriously. It's fine,0.06749674,0.07629784,0.45895407,0.58196646,0.8907955,0.9288007
518212,That should go both ways asshole! It takes two to tango so are you calling him a whore to? Shut up and step back.,0.09245483,0.039602257,0.35515398,0.7827088,0.844891,0.90451443
428219,Nobody from Boston can ever bitch about the refs again. Dirty fucking play from a dirty fucking team. Garbage call. Headhunts. Leaves his feet. Injures a player. Refs let it go. Fuck this league and it's favoritism.,0.36598656,0.05268431,0.45895407,0.71120167,0.89909166,0.9288007
40177,People on cod are actually@the weirdest mother fuckers on your team@there cool@but as soon as you beat them etc your a random scrub 😭😭y’all need to slit your own throats dead ass,0.35624164,0.54140383,0.5344867,0.6798578,0.73341435,0.91625386
536710,I fucking fuck this gay fucking earth fuck...,0.79850346,0.13815513,0.61476606,0.7497506,0.97765803,0.9880789
48686,karma is a bitch and that bitch don’t love you.,0.2028587,0.0116639575,0.35368225,0.72756535,0.89909166,0.9248995
47386,Niggas be acting like bitches 🥵 bitches be loving these niggas what’s up with these bitches 😬‼️,0.7895903,0.038911607,0.50703704,0.8012121,0.7888968,0.91625386
452312,I’m blocking any and everybody i see post that santana mf..hoe ass nigga need to be playing for the saints but wan be a bitch,0.6649212,0.09929679,0.45895407,0.7497506,0.80158395,0.9061063
401221,What a piece of shit ! What makes it worse they're not even from America !,0.37655997,0.019055385,0.42874086,0.71120167,0.8089582,0.9029226
418120,You literally rotated the fucking sprite on an axis bring back the National dex you cheap asses,0.27914262,0.03787563,0.45895407,0.7497506,0.8855216,0.9288007
489016,"cant stand ppl thinking they on some shit if they have expensive pieces fr fr money cant buy u style. u cant just walk up to a mall wearing all these fuckin idk anymore., u gotta figure out what aesthetics and how to execute it. learn bro. the fuck,,",0.10221587,0.12536226,0.45510182,0.5678696,0.8907955,0.911035
48187,wanna do something stupid tonight? — fuk off mate,0.05089863,0.063029334,0.39194742,0.65129566,0.8449782,0.911035
543622,Motherfuckers you fucked with my beauty for the last time - fear God and obey His commands,0.27171627,0.03165977,0.5520787,0.67254376,0.927271,0.944597
51471,What kind of fucking asshole steals a dog?! I hope it just ran out in fear while the place was being robbed. T_T,0.120924085,0.13815513,0.45895407,0.7762574,0.90862066,0.9288007
51479,"I'm blocking you now, because you're an idiot",0.11860296,0.043955702,0.29050803,0.87896585,0.5865656,0.91625386
55648,Stay where the fuck you are unless you want to get stabbed in the chest. You want to start something? Do something. DO. SOMETHING. DO SOMETHING MOTHERFUCKER! NOW! ENGLISH! DO YOU UNDERSTAND IT?!,0.19298288,0.5356442,0.61260825,0.7065844,0.91513264,0.9563754
556418,Add i blocked that dipshit.,0.10221587,0.016292779,0.35368225,0.6675394,0.8449782,0.9029226
460816,Ruiz 2020: no I don't hack in csgo now stfu and eat your food you fat cunt (sorry to my nigga z),0.6007182,0.114629425,0.45895407,0.7492263,0.79449326,0.90451443
541119,today is wednesday you fucks. today you do the thing you've been putting off for a month. today instead of hitting up mcdonalds hit up a healthier fast food place like subway. make today your bitch and don't call them back.,0.105256535,0.054624002,0.45510182,0.68668073,0.8907955,0.911035
44245,"Fuck you, Netflix, how about I stream my nutsack across your mom's originals and not even give her a reward. Take your stranger things and shove 'em up your ass while you give your balls a tug.",0.23618884,0.34804323,0.5552179,0.6308392,0.87472564,0.93383175
442410,IM GONNA BEAT THE SHIT OUT OF YOU DAWG,0.1808059,0.65849507,0.45895407,0.57787937,0.8089582,0.91625386
44857,argueing is so useless like fuck it bitch you got it,0.10221587,0.030278467,0.47416782,0.7657292,0.95876634,0.96069145
49368,fuck you twitter suck my dick and die in a car crash,0.3895355,0.5960661,0.66275287,0.802824,0.9421618,0.9749944
515112,I HATE TYPING ON MY FUCKING IPHONE!!!!!!!!!!!!!!!!!!!!!!!!!!!,0.056582913,0.023026628,0.45895407,0.40975618,0.8907955,0.9248995
470014,He is trumps bitch and he like it.,0.28034934,0.010809537,0.35022295,0.8390655,0.83974665,0.911035
558910,Hit the bitch then I kicked her out cause I ain tryna let the devil in,0.28034934,0.6615786,0.48825464,0.67735565,0.80158395,0.9248995
448912,You didn't know shit from shit,0.028886627,0.008116818,0.34942797,0.5239335,0.91513264,0.91625386
50038,Shut the fuck up you dimwit.....if you read properly you'd see that he said...he has nothing against Sweden...you bitch ass .....an idiot you are!,0.37361985,0.1368402,0.61476606,0.9191143,0.9205162,0.968226
500316,The town / county is filled with so much hatred stupidity and racist assholes it's amazing.,0.38208112,0.01508414,0.35368225,0.87225974,0.73341435,0.91625386
567911,You’re supposed to agree dumb fuck,0.10221587,0.014048163,0.45895407,0.83943826,0.9205162,0.96069145
567923,The best part of waking up...is feeling a fat dick inside your pussy as you ride it.,0.13591312,0.036149003,0.35368225,0.40698266,0.844891,0.911035
44881,Wish you'd wind your fucking neck in knobhead,0.18705739,0.60325533,0.5344867,0.71120167,0.8949436,0.9563754
448823,tldr: interstellar travel will be a motherfucking deathmatch if there's other intelligent life. kill or be killed,0.1508922,0.65905607,0.45895407,0.5130944,0.7785769,0.91625386
419722,what are you so cute for? bitch i’ll kill you,0.23467018,0.7940924,0.50703704,0.6677319,0.8089582,0.96069145
48307,You're out of your fucking mind.,0.05612817,0.010628296,0.35368225,0.7218519,0.9205162,0.93383175
542320,If you hate me you can suck a dick and think 'bout it,0.09162762,0.033386398,0.45185554,0.5129801,0.86331284,0.9248995
565022,She should have been burned alive in a salted furnace for this. Its outrageous that a hate filled racist bitch minority she-creature can get away with this god damn behavior.,0.46028158,0.59786344,0.5231034,0.7775208,0.80158395,0.9029226
504810,Aaaargh !!! Fuck fuck fuck fuck !!!! I fucking hate this part of the game !!!! ... 😭 😭 giving me nostalgic creeps like last time ... #metrolastlight #metroexodus #game #novel #epicgames #metro_exodus #ps4 #ps4pro…,0.07425626,0.06205949,0.6143386,0.48627716,0.92389363,0.96426713
422016,you know that gc is fuckin dog shit no one talks in it and when we do its me and fee fee talking,0.10221587,0.017328756,0.45895407,0.5130944,0.8949436,0.91625386
558013,Why? Cause they are all lesbians. I forget that lesbians post on this board. You lesbians put a bad name for all male posters here. Fuck off lesbians. Your are the reason this board is shit.,0.8182097,0.055270568,0.52891463,0.8204276,0.8855216,0.96069145
452223,"Yeah that bullshit is gonna come back to bite cp0 in the ass. Karma is coming for you, bitch",0.21470967,0.2836219,0.45895407,0.802824,0.92389363,0.9563754
53975,Impeach this lying piece of shit!!,0.06249457,0.12536226,0.42874086,0.8390655,0.84506536,0.9288007
539714,i’m EMBARRASSED to be white because of y’all racist ass mother fuckers 🤢,0.6682205,0.13228847,0.61260825,0.8032227,0.90150756,0.96426713
515922,// FOR FUCKS SAKE MAN GET YOUR SHIT TOGETHER I—,0.11047905,0.050744623,0.52891463,0.6308392,0.9342644,0.9563754
416815,"Fucking weirdo Mormons. Ole ""church is true, book is blue, we can too, blues clues"" headasses.",0.7207808,0.03649433,0.45895407,0.7827088,0.8855216,0.93383175
472414,And his wife she was a huge bitch,0.26325142,0.013269233,0.4011458,0.8204276,0.8186401,0.9248995
496916,Native Americans is some bullshit PC,0.6007182,0.011042561,0.35368225,0.6798578,0.85672,0.9029226
48997,yo fuck this fight this fight is literally aids innocence is just a massive dickhead,0.27759558,0.10236332,0.5843659,0.67735565,0.92389363,0.968226
513211,"*shit negro,that's all you had to say*",0.8102261,0.04233929,0.45895407,0.71120167,0.844891,0.911035
557822,how the fuck does this shit work #myfirsttweet,0.020580608,0.009463178,0.35040274,0.36798462,0.9205162,0.9029226
453920,This is the stupidest shit I’ve ever seen lmao. You just have an venti EXTRA ice mango dragon fruit... you played yourself... 😂,0.10221587,0.025098583,0.45895407,0.6798578,0.8086746,0.93383175
47871,I need to get it off my chest “fuck you niggas” 🗣,0.7426507,0.13815513,0.45895407,0.6500014,0.844891,0.911035
55477,Beat that nigga up ! Fuck recording him,0.8182097,0.54744303,0.5381526,0.7804726,0.84995824,0.944597
56077,I DON'T GIVE A SHIT NIGGER IF IT'S STEALING MY MONEY!!!!!!,0.821794,0.09623027,0.5381526,0.7922567,0.86331284,0.96069145
560713,A bullshit guy playing an bullshit game on twitch live at,0.099072486,0.011120236,0.39194742,0.6991143,0.8949436,0.9391453
57208,Plugged Sissy Analwhore....,0.22063516,0.029587816,0.47416782,0.7827088,0.8855216,0.93383175
766017,For fucks sake you thrust your hips back and forth until your dick throws up. It's not fucking rocket science. ,0.10221587,0.07629784,0.45895407,0.5145894,0.9205162,0.9391453
687819,"I said \""no\"" and he kicked me in the dick and spit on me. Fuck bacon",0.099899694,0.13815513,0.457266,0.5130944,0.92389363,0.9288007
75869,"Hey Eck: fuck, marry, kill David Price, Stat Masterson, Pablo Sandoval",0.28034934,0.60325533,0.5583572,0.6308392,0.8117245,0.9288007
758615,"gas station attendant: \""All of the gas station owners in this town go to my church. Now fuck off",0.36803186,0.13549154,0.45895407,0.6051471,0.8186401,0.90451443
758623,fuck off back to reddit and sage for SJW tears,0.15731181,0.044602267,0.45895407,0.5723624,0.89909166,0.90451443
65278,oh shit nigger what are you doing.,0.8386719,0.046541955,0.45895407,0.802824,0.8690192,0.93383175
727611,You are a fucking idiot.,0.12556632,0.01238892,0.47886345,0.96319175,0.9421618,0.9817629
727615,Total fucking hypocrites ... all of them,0.13591312,0.016120117,0.44787344,0.8012121,0.8855216,0.9391453
727622,Mother fucker,0.10221587,0.012440704,0.45895407,0.72756535,0.9540331,0.9563754
737321,"and most of them fucking complain about how we have low wages and equally shit structures, and wonder why most of the other countries around the world hate us while they simultaneously shit on each other by being plastic cunts and absorbing other cultures",0.37953663,0.012492486,0.35368225,0.6099415,0.8907955,0.9029226
65901,they do all sorts of shit,0.05089863,0.008738215,0.16960317,0.5129801,0.902047,0.90451443
661414,cut to 5th fuck up,0.028016793,0.10389658,0.35368225,0.46774593,0.8907955,0.9029226
661418,Realign your fucking dilithium crystals you quantum fluctuating being of pure energy before the transdimensional warp engine tears a hole in your anus.,0.10699738,0.12536226,0.45895407,0.5739874,0.90258646,0.95048624
758815,No degenerate spic fucking mexicans,0.84706575,0.039602257,0.5231034,0.7782364,0.8949436,0.9391453
758822,harden bleeding from the fucking eye...fuuuuuuuuu,0.044612918,0.18913531,0.45895407,0.4794537,0.8855216,0.91625386
61045,You know saying this shit on other sites not only HURTS your argument but makes you look like a collection of stupid fucking retards,0.38185352,0.022853967,0.52891463,0.87506694,0.92389363,0.96426713
761520,You are fucking retarded.,0.44690517,0.012699619,0.52891463,0.9191143,0.9342644,0.9749944
721123,Fuck off with this sorta bullshit.,0.04822223,0.020436687,0.45895407,0.72756535,0.96028095,0.9749944
757219,You cave dwelling neanderthals are fucked. Latinos will dominate this hemisphere again,0.77072054,0.09316374,0.45895407,0.68668073,0.844891,0.9061063
607717,Your ideology is shit. You are literal anarchists,0.3780483,0.012337137,0.35368225,0.7775208,0.8855216,0.93383175
62576,"Motherfucker two time FMVP and another MVP, and we got Harden who just shits the bed in playoffs, and CP3 who I pray to the NBA gods everyday he won’t pull his hamstring playing this fucked off team. Meanwhile Curry, KD, Fucking Draymond, Klay, and Iggy. Oh and Boogies out. Shit they’re fucked /s Miss me with that. The NBA is playing up to this teams level. They’re setting the precedent.",0.12208464,0.022681303,0.45895407,0.6120431,0.90862066,0.911035
605218,these people are goddamn parasites,0.28622448,0.016120117,0.36435235,0.8032227,0.8186401,0.9209984
605219,Go fuck yourself.,0.06795148,0.079364374,0.50703704,0.7492263,0.927271,0.96426713
604813,And you mean even less than everyone else. Fuck off,0.04332388,0.023889944,0.35368225,0.6407567,0.902047,0.93383175
753520,Jesus fucking christ on a pogostick,0.5051593,0.032695748,0.45895407,0.5678696,0.90258646,0.91625386
69351,"Congrats, you're an idiot",0.052490227,0.009411395,0.15443328,0.9028068,0.5365423,0.911035
69357,"I never said they don’t affect gameplay you ‘fucking monkey’ Also your name is shit, delete Reddit please",0.18391247,0.04132889,0.50703704,0.8012121,0.90862066,0.93383175
638014,Bullshit. I stick by everything I said. Fuck the homeless.,0.36598656,0.08396416,0.45895407,0.6407567,0.9540331,0.96069145
769317,This shit happens all the time in breaner infested shitholes,0.10409598,0.012803185,0.35368225,0.54471385,0.90150756,0.9061063
61447,Your grandmother was a whore that spread her legs for any Nazi that would give her a hovel. Nine months later,0.4774257,0.14960353,0.5188304,0.8032227,0.78491896,0.9029226
723223,Conservatives are as fucking stupid as liberals in America,0.6007182,0.012181788,0.44787344,0.8502231,0.8690192,0.9391453
686112,And not a goddamn single woman gives a flying fuck. Not complaining,0.381025,0.014220826,0.35368225,0.5130944,0.90150756,0.90451443
60189,What the fuck is up with the /v/ mods? Are they fags?,0.71720207,0.012906751,0.45895407,0.75027496,0.8802007,0.9288007
651119,freak the fuck out,0.051808115,0.063352615,0.35368225,0.5393265,0.91513264,0.91625386
694513,Oh my god damn why the fuck are you reviewing,0.045901958,0.012699619,0.4561839,0.4962726,0.90150756,0.9288007
694518,"looks like a cock in search of a blowjob, ya know?",0.058856625,0.014566151,0.35368225,0.43450394,0.79449326,0.90451443
75756,"All cops are bastards, fuck the justice system.",0.5039629,0.053654157,0.45895407,0.84251964,0.9205162,0.96069145
632621,I fucking hate Israel,0.8182097,0.05042134,0.45895407,0.5543018,0.8089582,0.9248995
609311,And these fuckers want no one to hate them and want people to be tolerant? Sorry can't do that when every time they open their mouths I want to crowbar-beat the fuck out of them for being so selfishly petty.,0.2783691,0.52547425,0.46947223,0.7418356,0.8949436,0.9248995
636112,You're an idiot.,0.051580742,0.009126588,0.16960317,0.91372794,0.5365423,0.9288007
636123,Fuck off materialist retard.,0.48949075,0.03649433,0.52891463,0.87506694,0.9421618,0.96426713
699615,Shit Piss Cum,0.1232452,0.014393489,0.45895407,0.61794597,0.90150756,0.93383175
693814,What a dumb bitch. What is she doing on social media.,0.10221587,0.022335978,0.35368225,0.8685752,0.8089582,0.9248995
616013,Fucking hypocrite,0.10221587,0.012751401,0.45895407,0.8012121,0.92389363,0.95048624
746516,What sort of a shitty fucking design is this? ,0.031206898,0.009825659,0.35368225,0.48627716,0.9421618,0.9248995
68425,Your a retarded bitch,0.44690517,0.015602129,0.50703704,0.9346156,0.9205162,0.968226
622421,pathetic whore said twat?,0.27701542,0.011586283,0.45895407,0.8082062,0.84995824,0.91625386
62208,fuck this shit,0.041261412,0.020091362,0.45895407,0.5072643,0.96028095,0.968226
70237,also stop talking about this little shit,0.035331827,0.012026439,0.349583,0.54471385,0.8326356,0.90451443
61131,Ohhh fuck off...,0.027413858,0.019918699,0.4195425,0.5723624,0.90258646,0.9209984
611319,Brock Lesnar the piece of shit,0.14661247,0.0113014765,0.3735507,0.84251964,0.89909166,0.944597
65359,What the fuck is wrong with these bitches,0.2854555,0.029933142,0.45895407,0.8390655,0.95876634,0.968226
63959,Go fuck yourself,0.073429056,0.09776353,0.50703704,0.7298119,0.92389363,0.96426713
743312,nah fuck off,0.037909906,0.016120117,0.35368225,0.57566804,0.90150756,0.91625386
636719,FUCK this.,0.013043936,0.011974656,0.35112193,0.3416952,0.90862066,0.9061063
72255,So please stop trying to use freedom of speech to back up your shit or defend the shit you do,0.06749674,0.012078222,0.34977677,0.6407567,0.8907955,0.9029226
668523,just read the article you stupid armchair-protester faggot,0.58354634,0.02855184,0.44969136,0.8685752,0.77181685,0.911035
631117,"How the fuck is this level of maximum-drive full throttle retard even possible. Their rules are basically \""We are right because we say so and if you show us evidence that we are wrong then fuck you.\"" ...and these faggots consider themselves to be the open minded ones?",0.6007182,0.11616269,0.460081,0.7762574,0.8855216,0.911035
64736,Are you fucking stupid? Plato said it was destoryed by a 'calamity',0.10221587,0.023889944,0.44787344,0.87506694,0.90150756,0.95048624
708721,Bruh cause Aids is caused by fucking anal sex...,0.24074486,0.023026628,0.45895407,0.4339631,0.8907955,0.9288007
639421,"Cartoon Nazi frogs? Indeed, stupid as fuck.",0.46028158,0.014738814,0.44787344,0.8012121,0.8949436,0.93383175
725520,maaaan you are fucking stupid. Doesn't matter that this is anonymous and on 4chan but you need to realize... you are fucking stupid.,0.18391247,0.021645326,0.56375664,0.91372794,0.927271,0.9749944
60827,And a fucking goon.,0.10221587,0.011819307,0.34977677,0.6675394,0.89909166,0.9029226
66176,Just go ahead and kill yourself.,0.09576365,0.73375875,0.45895407,0.48569724,0.39498812,0.90451443
624322,"America: \""LoL fuck off pussy!",0.33060804,0.029415153,0.5520787,0.68668073,0.9342644,0.96069145
61199,You fascist dicks.,0.46028158,0.016810767,0.44787344,0.78565484,0.8326356,0.9288007
668420,actually fucking try idiots.,0.10221587,0.03856628,0.44787344,0.8579266,0.927271,0.9563754
760818,So you want to kill your dog because you can’t pay for it? What kinda fucked up shit is that? Give it up for adoption how much of a piece of shit do you have to be to look into an innocent animals eyes and say “I can’t afford to take care of yous o I’m just going to take your life”. Wtf is wrong with you,0.10815793,0.5356442,0.45895407,0.64537907,0.83974665,0.911035
629115,ANSWER ME OR GET THE FUCK OUT.,0.028886627,0.10236332,0.35368225,0.49389273,0.902047,0.9209984
645620,All conservatives are idiot retards.,0.57150364,0.012181788,0.35368225,0.9063489,0.66456485,0.9288007
732610,US is shit,0.5051593,0.009437286,0.3247677,0.6675394,0.8855216,0.91625386
732623,Fuck that shit.,0.02439919,0.013165667,0.4195425,0.47273466,0.96028095,0.96069145
767017,"Ira: \""shut up and suck my dick.\""",0.1444726,0.039602257,0.51028454,0.6308392,0.90258646,0.95048624
713617,"You fucking inbred beaners keep calling yourselves \""Memers\"" and \""Trollers\"" all the fucking time here",0.49855098,0.035113025,0.56375664,0.7782364,0.92389363,0.95048624
62181,pretentious newfag bullshit.,0.5548181,0.014738814,0.45895407,0.6991143,0.8907955,0.9061063
695918,suck my cock,0.09824528,0.029587816,0.50703704,0.48627716,0.8907955,0.9563754
662514,I clearly don't give a fuck that you don't give a fuck.,0.028628819,0.010731863,0.35368225,0.5130944,0.9342644,0.9209984
662516,Fucking filthy snowniggers,0.84706575,0.056563694,0.56375664,0.83943826,0.9205162,0.96069145
634123,When you are tucked do you fart on your own dick?,0.057037655,0.059796512,0.35368225,0.46923602,0.8117245,0.9061063
672816,What a bunch of shitheads. Hope some scumbag stabs them all.,0.2816105,0.73068005,0.5520787,0.84251964,0.7785769,0.95048624
728212,Both sides are evil and doing some nasty shit.,0.099072486,0.011974656,0.23224458,0.5935568,0.8907955,0.9061063
753211,If you want to spout ignorant lies and suck daddy government's dick then you can fuck off back to reddit with all the other libtards,0.41975367,0.044602267,0.61260825,0.7775208,0.91513264,0.95048624
686411,shut the fuck up about this non-issue,0.044612918,0.030278467,0.44787344,0.58196646,0.902047,0.9248995
76141,JOHN. FUCKING. RABE bitch,0.31892163,0.1329628,0.61260825,0.7967344,0.9342644,0.96069145
69661,"""just hanging around a bunch of nerds. don't know how to fuck. dorky fucking losers...",0.40713623,0.48207104,0.61260825,0.87225974,0.9342644,0.96069145
65441,"Holy shit, these people are nuts.",0.23467018,0.0116639575,0.35368225,0.72868866,0.8907955,0.9248995
654411,somehow fucking lesbians is more satisfying,0.71720207,0.09009721,0.45895407,0.57566804,0.87472564,0.9248995
613821,Scratch the deep hemorrhoids in my anus then sniff my finger.,0.09659086,0.091630474,0.44787344,0.39743927,0.7654259,0.911035
693710,He's the one who fucking started the war with ridiculous shit like the torture of the graffiti children in Deraa and the siege on the city,0.15517195,0.13785169,0.45401973,0.5270482,0.87472564,0.9029226
693711,"I want to meet the morons that kill themselves over a strangers words. Some people should die, and its not your fault for speaking its the listeners fault for being a fucking moron. Jesus fuck.",0.37507164,0.5487409,0.46947223,0.8204276,0.902047,0.944597
