instance_id,text,IDENTITY_ATTACK,THREAT,SEVERE_TOXICITY,INSULT,PROFANITY,TOXICITY
275316,can really kiss my ass. I been waiting on a phone that was ordered since last week and have nothing. Dont bring your business to them. AMD your CEO is a weak piece of shit,0.11744241,0.029587816,0.35368225,0.69164425,0.85672,0.9288007
235419,"I have had enough with this fake kicking it shit , kick a bucket or some shit 🙄",0.104676254,0.52547425,0.45895407,0.5678696,0.8089582,0.9209984
25681,My roommate deadass is a stupid cunt,0.18002926,0.026479885,0.44713756,0.87225974,0.90258646,0.944597
349914,THE FUCK DO YOU WANT ME TO DOOOO CUNT,0.09576365,0.1575099,0.50703704,0.5130944,0.84995824,0.9061063
349921,fuck you..go back protecting rape,0.22458547,0.44605255,0.5344867,0.6500014,0.8326356,0.9248995
316022,annnnnnd I'm done. Good night /pol/ fuck yourselves.,0.052944973,0.10236332,0.44787344,0.5935568,0.902047,0.9248995
250711,"fuck that, fuck having friends dude",0.046159767,0.013372798,0.42874086,0.4794537,0.9342644,0.9288007
29925,This was a comedy skit right? You guys aren’t that fckn stupid...right?,0.104676254,0.011120236,0.35368225,0.7827088,0.83974665,0.9061063
299210,"Do Your Fucking Job, #DoYourJob Asking progressives to stop paying attention must sound like a nice return to your ancient past where everyone lets Democrats be as awful spineless cowards as they wanted to be, Fuck That and fuck right off. #ImpeachThemAll #Impeach",0.2949366,0.15276608,0.50703704,0.7418356,0.902047,0.9248995
21635,You really fucked us up here you retards. Whats the point of C+= now that they will fucking blame on the scawy white men.,0.73072165,0.10542984,0.52891463,0.7922567,0.89909166,0.9391453
323813,THE FUCKING STUBBLE AND THAT HAIR,0.044612918,0.013476364,0.44787344,0.46173862,0.8949436,0.9029226
348313,"most replies consist of ""fuck off faggot",0.57150364,0.019055385,0.45895407,0.7827088,0.92389363,0.9248995
281822,"Currently got a fucking cut behind my bottom lip, shit been killing me all day. Brackets keep getting caught in the cut like bitch",0.11976352,0.18281023,0.35368225,0.6109131,0.9205162,0.9061063
34796,He's not doing this to be thanked you worm-brained dipshit,0.22783615,0.012337137,0.44787344,0.8390655,0.8086746,0.9061063
367422,Go fuck yourself you ugly Jewish boy,0.8742209,0.21332647,0.641557,0.8987166,0.9342644,0.9817629
21189,edgy photographers travel to foreign countries in east asia and start talkin pics the locals without their consent talmbout “street life 35mm” bitch shut the fuck up,0.38208112,0.061412923,0.45895407,0.7418356,0.89909166,0.9288007
211814,"If any fucker mansplains this, it’s an instant block and then I’ll hunt you down and kill you",0.30103904,0.85759705,0.61260825,0.6831271,0.86331284,0.96426713
287414,Hey dickless leave ladies alone here ya weakass bitch.,0.29798782,0.030278467,0.51028454,0.8685752,0.8855216,0.95048624
223211,This kid is an IGNORANT SHIT! LETS FIND HIM PLEASE!?! 😤,0.10221587,0.13853464,0.45895407,0.8032227,0.78491896,0.944597
335911,Are you fucking serious keem? You act like your sorry about etika and now this? You really are a fucking pustule.,0.20878418,0.01508414,0.45895407,0.8131897,0.9205162,0.9391453
266614,A man full of ego and bullshit,0.15303208,0.009204263,0.30192792,0.71120167,0.8855216,0.90451443
31009,"Once I feel like it’s fuck me , it’s gone be forever fuck you",0.046159767,0.13815513,0.45895407,0.50440645,0.902047,0.9209984
300016,still a couple bitches that needa be slapped,0.33060804,0.6094174,0.457266,0.7344449,0.776286,0.90451443
31777,No people oppose you because you're fucking stupid.,0.14019285,0.010369381,0.45895407,0.9063489,0.92389363,0.96426713
31778,You are literally insane to submit yourself to rules about this kind of shit,0.06658725,0.011379151,0.35220072,0.71027446,0.85672,0.91625386
231817,😂😂😂 what the fuvk is this shit?,0.026609946,0.009281937,0.35368225,0.37279442,0.90258646,0.911035
314218,count your fucking days bitch lmaoooooo,0.11280017,0.061089642,0.51028454,0.7782364,0.9421618,0.96426713
24181,"it’s the truth, also imagine even joking about being disabled, you’re fucking disgusting",0.17847598,0.011819307,0.35368225,0.71027446,0.8449782,0.9029226
331021,You’re a f*cking moron for posting this shit.,0.17226285,0.017674083,0.51028454,0.9382069,0.9421618,0.9749944
348916,Fuck outta here son you filthy wetback.,0.2869935,0.051067904,0.5520787,0.8685752,0.92389363,0.96069145
222110,"got my bottle of Patron, fuck you shit talking motherfuckers, i would tag you but i don’t fuck with retards",0.37432748,0.13815513,0.5344867,0.7418356,0.90150756,0.944597
283510,the goat with this art shit..,0.06613251,0.018019408,0.35094213,0.5678696,0.87472564,0.90451443
27885,mmm nah yoongi seeming like a whole weirdo wtf bitch it’s u,0.28034934,0.017846745,0.44787344,0.7804726,0.8086746,0.90451443
236113,Stomach bitch 🤬 I hate this shit,0.2869935,0.077831104,0.50703704,0.7782364,0.902047,0.96426713
275523,"I hate kpop, bitches be like ""she's the prettiest girl in the industry"", fuck you which one",0.39461556,0.060443077,0.45185554,0.65231085,0.89909166,0.9288007
258512,All degenerate behavior is wrong you shithead.,0.2127345,0.025271246,0.35368225,0.8082062,0.84506536,0.90451443
300215,Trump’s dumb ass doesn’t have two brain cells to rub together. 🤦🏾‍♀️,0.1444726,0.01698343,0.35368225,0.8131897,0.6919765,0.90451443
32841,Bitch wtf. There's hard copies of Indigo!? 🔥🔥,0.14233272,0.039256934,0.44787344,0.6370372,0.8255558,0.9029226
328412,this is why you ask for light ass dumb bitch,0.30256465,0.035803676,0.45895407,0.8390655,0.902047,0.9563754
213315,3JIN???? BITCH WHAT THE FUCK IS THAT??? ILL **** YOU,0.18002926,0.34804323,0.6134631,0.7775208,0.90862066,0.968226
311413,can't even speak to the degenerate sluts that I encounter,0.29951343,0.031314444,0.35368225,0.8012121,0.8086746,0.9029226
259712,Sure as shit this nigga was talking about how alien species all become jesus,0.8182097,0.027515862,0.45895407,0.71551245,0.8186401,0.911035
283710,Supreme Patty is a fucking idiot 😂,0.18002926,0.011922873,0.44787344,0.87896585,0.90258646,0.9563754
205017,“I hang around nothing but bad bitches.” The bad bitches:,0.28034934,0.43915427,0.35368225,0.75027496,0.87472564,0.9029226
360523,This is the most ghetto shit I've ever seen,0.24801466,0.011456826,0.3494667,0.5208188,0.8690192,0.9029226
276423,I'm back bitches and bitchos,0.46028158,0.016465442,0.45293763,0.8012121,0.8855216,0.9209984
216919,Fuck my ass mistress you look so fucking dominant,0.17303948,0.09316374,0.48825464,0.5072643,0.8255558,0.9029226
305119,"Disabled fucking rapist, IM DONE LMAO",0.38699543,0.41113588,0.5454843,0.6407567,0.8186401,0.91625386
32278,In every shit country these niggers come from they kill each other with startlingly high rates of homicide. So when they come to Germany or America they of course are still murderous shitskins who keep killing each other.,0.84706575,0.44942492,0.50703704,0.75027496,0.8255558,0.911035
350310,"Why isnt the majority just quitting their jobs and saying ""fuck this shit",0.04332388,0.011974656,0.2847981,0.47384647,0.9342644,0.90451443
36799,"all the fucking stupid celebrities have lost it. lost the plot completely. all because of these fucking mixed race shits, who think they're malay, fuck em sluts whores",0.6220118,0.13815513,0.61260825,0.88346136,0.9540331,0.9749944
321122,Fucking trashed. Go crash a plane zipperhead.,0.2028587,0.5253276,0.5454843,0.7827088,0.90150756,0.95048624
26305,"Hey first slut of the white house, why are you sticking your chin up in the air? Your shit stinks even worse with that creep to hang onto.",0.30103904,0.43915427,0.49295026,0.8685752,0.844891,0.9248995
26306,Do you even have a clue how ridiculously childish you sound??? What an asshole.,0.1015541,0.013269233,0.45895407,0.8579266,0.8089582,0.9248995
32938,Bitch ass KD still ain't thanked the fans yet.,0.2127345,0.022163315,0.4379392,0.71551245,0.86331284,0.911035
329320,is legit the worst fucking institution I have ever dealt with. Customer service absolutely sucks and they should be ashamed of themselves,0.27662867,0.025616571,0.44860926,0.64537907,0.8907955,0.9248995
227111,So you can tell she’s a dude by playing with someone? Bitch you’re dumb you premature tube baby,0.25986546,0.04132889,0.45895407,0.802824,0.776286,0.9248995
24455,The Fuck he don’t!! I’m okay with Taekook shippers but you are getting on my nerves. All the time Jungkook spent with Jimin with a smile on his face and you Fucking all that Hate!? If you keep this up we all are gonna Hate you!! 👎🏻🤬😠😤🖕🏻,0.25478655,0.44901076,0.61260825,0.6500014,0.8086746,0.93383175
26231,"It's fucking sad that he had to say ""I'm a software engineer""...dude FUCK that guy he doesn't need to know you're career.",0.052944973,0.035458352,0.4195425,0.5543018,0.90150756,0.9061063
318315,"aoas the bitch wants to cooperate, u make me sick",0.23846684,0.032695748,0.35368225,0.72756535,0.8089582,0.911035
254121,SHUT THE FUCK ISTG OMG ILL FUCKIN KICK U,0.08252834,0.7299411,0.71338886,0.69164425,0.89909166,0.944597
223611,Dumbass. You’re supposed to tell them as you’re getting dressed after fucking them.,0.089973204,0.014220826,0.44787344,0.75027496,0.91513264,0.944597
285020,And the only thing that come out this hoe mouth is that I’m ugly. Well this ugly bitch here got everything you want including your bitch 😂😂😂,0.28034934,0.12996206,0.52891463,0.71120167,0.7246992,0.90451443
33966,"Do not fucking lie to me BUT if u feel u have to, sidung 1 away and mek up something whe mek rass sense. Don't tell mi nuh fuckery lie.",0.2774022,0.06238277,0.46477664,0.5739874,0.90150756,0.91625386
29401,"these boys need glocks out here, fuck da bullshit. open fire on anybody trynna take their life 😤",0.20878418,0.5940531,0.50703704,0.5678696,0.7809412,0.9061063
23495,FCUK BBC !! You suck big time !!,0.10221587,0.018882722,0.5188304,0.6308392,0.8690192,0.9209984
205521,it is your mother that is dumb,0.17925262,0.0091524795,0.2281948,0.87225974,0.4840093,0.9029226
279510,These fucking kids don’t kno shit bout these....this day is for the adults !,0.2028587,0.045895394,0.45895407,0.5935568,0.86331284,0.9209984
341419,We are not fucking Hateful stupid fuck...,0.105836816,0.023889944,0.50703704,0.7497506,0.94929975,0.9563754
363721,Unless you are that one single person in to fucking cactii down your penis. Pretty sure you are the only one.,0.053854458,0.06626215,0.35368225,0.47384647,0.87472564,0.9209984
367012,"fuck everyone, all i care about is tsukkiyama in chapter 298 aka the shield and the spear",0.078392304,0.049128212,0.44969136,0.40243408,0.8802007,0.9061063
225919,y'all seriously gonna use Lion King for your political agendas? It's a fucking KIDS movie. A FUCKING KIDS MOVIE,0.099899694,0.017846745,0.35515398,0.4986907,0.8907955,0.90451443
206410,After fucking your sisters and your wife and your daughter without using any lubricant🖕🖕🖕🖕,0.24462871,0.2330281,0.61260825,0.5678696,0.7466957,0.9029226
206412,how about fucking off with that bullshit?,0.036105253,0.03856628,0.45895407,0.57787937,0.95876634,0.96069145
235623,I have heard Mike pence is a fucking moron.,0.18313584,0.009256045,0.35368225,0.89108896,0.89909166,0.93383175
267314,turns out you're a 100% that bitch?,0.16993292,0.010110466,0.35022295,0.802824,0.8449782,0.911035
21016,And we get labelled delusional!!! Fuck off,0.037394293,0.01698343,0.35368225,0.6099415,0.8802007,0.9061063
35369,Why do u people encourage this bitch?,0.15945168,0.015947454,0.33047765,0.7827088,0.8117245,0.90451443
31577,stay up who i only know fuck up,0.0376521,0.051067904,0.44787344,0.54471385,0.8907955,0.91625386
21659,BAHAHAHAHAHAHAHAHAHAHA holy shit what a stupid fucken thing to say... even for twitter,0.0543092,0.012026439,0.45895407,0.65129566,0.9205162,0.95048624
216521,That little girl looks old as shit,0.26663736,0.012181788,0.35130173,0.71027446,0.8186401,0.9061063
240315,biiitch me too!! it’s always so lit and most of them bad bitches lol,0.27682206,0.06820184,0.44787344,0.6677319,0.84995824,0.9029226
248415,Fucks sake this shit has already infected comic books,0.07425626,0.013113883,0.44787344,0.5130944,0.927271,0.944597
217514,Is this bitch annoying on purpose?,0.17070955,0.012647836,0.35220072,0.7090544,0.8449782,0.9061063
217516,Y’all recycle the same shit,0.094936445,0.009126588,0.23223771,0.5678696,0.8802007,0.9029226
349514,Fuck it I’m bout to start exposing all the bluffing bitches on my tl who be getting slutted behind the scenes and be on here acting like they the shit. Miss me with the mentions shorty suck dick.,0.27914262,0.13498579,0.49764585,0.65865606,0.8949436,0.9209984
349516,It does matter. Read the laws of the game you uneducated fuck,0.099899694,0.013165667,0.35368225,0.7497506,0.89909166,0.911035
31326,Nigga did u just take that shit straight out the refrigerator and throw it in the microwave wit no plate dog ?????,0.7778623,0.25272974,0.45895407,0.6991143,0.80158395,0.9029226
313216,fjiafhaifhagihag why do yall have to be so fucking savage LMFAOOOooooOOOOOO!!!!!!!!!!!!!!!!! ARRESTED FOR TESTINGGGGGGGG OMFG,0.18546575,0.054947287,0.5583572,0.6120431,0.8089582,0.93383175
26697,bitch tf not the genre the russian literature 😭😭😭😭😭,0.35948995,0.031314444,0.45895407,0.62169385,0.7796426,0.9209984
258714,fuck lunar planet i want Roll.D to come back her vid edits are insane,0.10221587,0.13346854,0.457266,0.48627716,0.8086746,0.90451443
21445,thought u was real but you lied to me bitch,0.11976352,0.013579931,0.35184112,0.71551245,0.83974665,0.90451443
35471,"actually i can’t hang out tonight, or tomorrow, or ever again. fuck off.",0.025806036,0.02682521,0.35368225,0.5208188,0.902047,0.90451443
247114,The result being fucked over some rich assholes toy or an uninsured asshole. Not worth it.,0.17459276,0.04233929,0.45895407,0.6991143,0.90258646,0.9209984
321223,"You fuckers keep talking about being ""red pilled",0.2331515,0.013010317,0.35368225,0.65865606,0.8855216,0.9029226
357814,Shut up and go chase that bag bitch,0.18468912,0.08856395,0.45895407,0.8502231,0.8802007,0.95048624
339119,I GOTTA HIT YOU WITH SO MANY HITS TFUCK SJSJkJSJSJ BITCH THINK HES KOREAS THE WEEKND AND HE AINT WRONG,0.2700233,0.68668276,0.61260825,0.6051471,0.8117245,0.93383175
232822,Stop being poor and buy more shit.,0.11744241,0.012181788,0.23340854,0.6149945,0.8690192,0.90451443
34667,So heartless bitch I hate you,0.35299334,0.13144556,0.45895407,0.8032227,0.87472564,0.96069145
325618,"Black men in Twitter... Please stop acting like you have never heard of gay people before. Everytime a man mentions being gay too many of y'all talking about ""pause""... Please shut the fuck up",0.71720207,0.053330876,0.45895407,0.69164425,0.7809412,0.9061063
302211,Thats your orange moron speaking to you. Your a fool a SHEEP. repubes use you. Hows ur heakthcare water roads no ur an idiot !,0.12735364,0.010731863,0.23223771,0.89108896,0.4662011,0.9029226
243411,I always thought you were a no talent idiot but now I see you for what you really are..a vicious no talent idiot,0.094936445,0.011508608,0.23226346,0.87896585,0.49259362,0.90451443
314919,"Fuck buying that shit, nigga we gon lick sum",0.7937624,0.1366716,0.46477664,0.72756535,0.90862066,0.95048624
258621,dont be friends with ninja he makes the gta community bad! fuck dude might as well leave this shit! people just support little 12 year scammers such like ninjahd! Quit.!,0.23163283,0.079364374,0.45895407,0.66500133,0.8117245,0.9209984
340113,Niggas don’t be knowing shit.,0.79850346,0.012803185,0.39194742,0.7065844,0.84506536,0.911035
25227,I don’t like any of you cheap ass cologne wearing niggas. Messing with my damn sinuses,0.7426507,0.05430072,0.45895407,0.755201,0.8255558,0.9209984
252223,Majority of you bitches are weird.,0.36702603,0.012285355,0.35368225,0.802824,0.86331284,0.9209984
215010,keep this shit on repeat! get dem white folk sick,0.77429146,0.38377953,0.4561839,0.6675394,0.8089582,0.911035
262612,Just busted a big fat fucking nut,0.26663736,0.027861187,0.45895407,0.6308392,0.90150756,0.9288007
239521,U a dumbass you and Bob Murray complete assholes,0.27510223,0.035803676,0.50703704,0.87225974,0.7888968,0.9391453
315212,"😆what the fuck champ,😕are you alright? 🤨Get the strap,the man tried to kill you. Now you got ace bandage on ya ankle and shit. LOL #lecheminduroi #bransoncognac",0.18158256,0.49142194,0.52891463,0.6308392,0.844891,0.911035
301019,Mother fucker act like you don't eat cheese I fucking dare you.,0.11860296,0.042985857,0.5381526,0.755201,0.9540331,0.96426713
273318,bitch can you please follow me wtf,0.20878418,0.016810767,0.35368225,0.7090544,0.84506536,0.9029226
352222,Numbuh 5 grew up to be a boss ass bitch,0.23694818,0.01508414,0.44787344,0.78882504,0.90150756,0.9391453
223823,Living in the south fucking sucks. Too many die-hard christian white trash like my cousins who go to church every sunday,0.79850346,0.060766358,0.50703704,0.71120167,0.8690192,0.9288007
32435,If they start a war over that bullshit.. dumb. just fuckin' dumb.,0.09576365,0.13815513,0.35368225,0.7967344,0.90258646,0.9288007
22901,Majority of UK citizens despise you - fuck off out of our politics - w**ker,0.36702603,0.022681303,0.45895407,0.7657292,0.8949436,0.93383175
27477,Tell me where I’m wrong you fucking cow,0.10221587,0.03304107,0.44969136,0.7657292,0.8949436,0.9209984
211418,“Laziness is a trait in blacks.” - Donald Trump. You look fucking stupid.,0.6458014,0.015429466,0.44787344,0.87896585,0.86331284,0.944597
24829,Fuck... your collar bones are gonna fall out?! Shit we're all doomed! No one talks about these things?!?!,0.048737846,0.058826666,0.44787344,0.47384647,0.90150756,0.9061063
215313,"Not only is this anime trying to emotionally murder me, but it also wants to convince me that Luke motherfucking Triton is married to a gorgeous fucking lady and is also missing. Fuckin fuck me, literally just rip my brain out",0.10221587,0.13815513,0.44787344,0.4710501,0.92389363,0.9029226
291112,It’s a fucking floppy disc goddamit,0.029144434,0.010110466,0.35368225,0.47020787,0.90862066,0.90451443
31276,"Any time you can stop with this bitch, because this bitch just your fan only. This bitch enjoy your song everyday.",0.2823795,0.02803385,0.46947223,0.7804726,0.84506536,0.95048624
312719,I don’t really but fuck I want to kill myself sometimes cause idk wtf I’m doing,0.055218685,0.60325533,0.45401973,0.36798462,0.8086746,0.90451443
201810,Fuck both of y’all especially you iyona,0.17303948,0.13815513,0.50703704,0.6308392,0.80158395,0.911035
35428,you need to play golf witH fucked up Sweden government to free Rocky. Do tHem birdie in tHeir fucking assHoles!,0.5124616,0.13815513,0.45895407,0.65231085,0.8907955,0.9209984
31247,FUCK YES FLAN!!! FUCK YES!! PLEASE LET ME KNOW WHAT YOU THINK!!!!?!? The first season is great but trust me.... it’s only gets better &amp; better man,0.055673428,0.049451493,0.52737635,0.48399165,0.89909166,0.9248995
312410,Fat as fatass lesbians one table over turn and give him the die cisscum death glare,0.6637263,0.60325533,0.52737635,0.72868866,0.6643082,0.9029226
33767,"Tell me why I believe your stupid ass, but rather be dead than to wear a fucking tutu",0.24462871,0.3733964,0.47886345,0.7967344,0.9205162,0.9563754
317614,Yes! Those fucking Russians!,0.7778623,0.018710058,0.45895407,0.67735565,0.8802007,0.9248995
245413,can the nigga I LIKE say this to me. Fuck. 😂,0.7426507,0.05947323,0.45895407,0.64537907,0.8449782,0.90451443
25499,Coulter you’re a pile of steaming bullshit. What kind of person has such an evil idea and isn’t ashamed? What would your mother say about your mean-ass heart?,0.11512129,0.02492592,0.45895407,0.78882504,0.8186401,0.911035
330722,No.. But to fuck that Bastard Assad. And send him to Hell ASAP.,0.36733335,0.5195707,0.50703704,0.7922567,0.89909166,0.944597
268711,Go the fuck back to mexico you degenerate spic mexican.,0.8836641,0.11002964,0.6224206,0.87225974,0.902047,0.968226
268722,How did they fuck that up... How hard is it to fuck up the name of a popular character,0.02439919,0.026479885,0.35368225,0.31740165,0.8907955,0.9029226
285313,Maybe because you're an idiot?,0.035847444,0.008375733,0.08332442,0.8987166,0.5013569,0.90451443
36958,HE WAS JUST A FUCKING UNDERACHIEVER,0.10221587,0.011689849,0.44787344,0.6308392,0.89909166,0.9029226
288919,Tyreek is a piece of shit.,0.23163283,0.010809537,0.35368225,0.87225974,0.90258646,0.9563754
351619,The bitch had the audacity to call Ariana not even good wanna get your ass beaten up???,0.17925262,0.4902736,0.45895407,0.6407567,0.7785769,0.90451443
403522,Fuck Instagram. I will say all the offensive shit I want,0.09659086,0.13815513,0.45895407,0.47384647,0.927271,0.95048624
42635,AAAGHH WHY IS HE SO MAD AT ME HE KNOWS WHAT I DID! I'M NOT APOLOGISING FUCK YOU MURDER CAT!!,0.11163961,0.44942492,0.56375664,0.6336687,0.8802007,0.95048624
557315,both are retarded faggots shitting up /pol/,0.7426507,0.035458352,0.5344867,0.87225974,0.89909166,0.95048624
557316,Damn white people lol why can't you make one working civilization? Damn,0.7028837,0.039602257,0.45895407,0.6099415,0.7888968,0.9029226
51717,"Bitches , she said bitches. Not woman who are already love themselves because they learned that in their fucking teens, instead of getting their self worth from some dude who was trying to fuck em. That’s why ladies/woman turn into wives ! And bitches into toys used &amp; unloveable",0.48915586,0.1284288,0.52891463,0.6798578,0.87472564,0.9209984
456812,"Move bitch, a nigga need a little space (uh-huh) Don't tell me I'ma be okay 'cause this shit not okay Give a fuck 'bout what you think bitch, fuck what you think But don't come judgin' me 'cause I had too much drugs and drank",0.7499929,0.16699752,0.56375664,0.8012121,0.91513264,0.944597
456819,"“But all you waddling penguins will get hurt if you overwork because rappers these days don’t have the skills They all have a snap back fetish, You`re such a faggot bitch”",0.55044734,0.09776353,0.45895407,0.8082062,0.8186401,0.91625386
48039,Get away from her you BITCH,0.23391083,0.067232,0.44787344,0.8390655,0.8326356,0.91625386
508210,“City boys” that shit sound gay stfu,0.7778623,0.018882722,0.45895407,0.71120167,0.84506536,0.9563754
484916,You’re a fucking psychopath for thinking this Jesus h Christ,0.3780483,0.020264024,0.45895407,0.8204276,0.8855216,0.944597
566118,NICE SPOILER1!!!! FUCK YOU,0.04280826,0.075531214,0.50703704,0.65129566,0.8949436,0.95048624
566119,Steve Harvey a bitch for writing think like a man... he really fucked up the game for the older niggas,0.73072165,0.030969119,0.460081,0.802824,0.87472564,0.93383175
48207,"this is so fucked up, these boys are so inconsiderate",0.12208464,0.014911477,0.35368225,0.5130944,0.84506536,0.9029226
553915,how many fucking times do we have to do this. cheryl has been confirmed as a lesbian on the show. can you just leave lesbians the hell alone istg,0.6853638,0.058503386,0.45895407,0.6120431,0.8326356,0.91625386
445917,Niggas so stupid that’s Cboy on his account 😂,0.8102261,0.03718498,0.45895407,0.8032227,0.66405153,0.91625386
414617,hmm. we will duck what’s the word it’s like conclusion ??? concede ??? fuckig constipate aaaa con con what the fuck it’s like right there oh my god FUCK ok aleix what’s the word help,0.06613251,0.079364374,0.46947223,0.4710501,0.84506536,0.9061063
557610,Does your grandmother watch you fuck?,0.07673789,0.021990653,0.45895407,0.57787937,0.90150756,0.9391453
49787,"Open your fucking eyes guy… Polling stations were closed in Arizona, people dropped from rolls all across the country, believe me the democrats are noT democratic. That shit was rigged for her and she still couldn’t win lol",0.17381613,0.03787563,0.45895407,0.6308392,0.87472564,0.9248995
506017,FUCK whoever retweets nasty shit on to my timeline LMAO,0.10221587,0.05236103,0.48355904,0.65129566,0.92389363,0.9563754
425912,"bitch if he cute to me, then why do you feel the need to voice yo opinion? you don’t see me calling yo bitch fat do you? no bc i ain’t gone knock nobody relationship down the fuck, if yall happy then yall happy. and bitch idk your last name so pls give it to me so i can look.",0.2869935,0.1366716,0.51028454,0.6991143,0.8449782,0.911035
40371,just saw a spoiler for ffh im going to break your fucking kneecaps TAG YOUR SPOILERS,0.11744241,0.65430456,0.5145575,0.5130944,0.78491896,0.9209984
443814,ask me if i give a single fuck about those dirty unwashed rats,0.17614605,0.05559385,0.44787344,0.69164425,0.8802007,0.91625386
527421,"Fucking up you life, was it enough for you?",0.0543092,0.18281023,0.45401973,0.5332045,0.8855216,0.911035
527423,Still not going to the White House. Fuck Donald Trump.,0.25478655,0.048481647,0.34969926,0.6336687,0.84995824,0.9029226
53955,"did you read the post at all? I’m looking for advice to get away from my abusive and neglectful parents before this situation escalates into something more nightmarish than it already is. Thanks for being a fucking asshole, though. Go fuck yourself.",0.105256535,0.06820184,0.45895407,0.8131897,0.9205162,0.9391453
479814,to my shitty homophobic parents? no lol,0.55044734,0.028897164,0.42874086,0.69164425,0.8117245,0.9029226
400414,nah shes fucking black dudes in the school toilet.,0.7778623,0.045572113,0.45895407,0.6336687,0.8449782,0.91625386
439022,south africa is a shit hole once more,0.6220118,0.024062606,0.35368225,0.65865606,0.83974665,0.90451443
562223,Who knows but what a piece of shit that other guys is,0.10409598,0.012078222,0.3529199,0.755201,0.85672,0.9061063
48528,ok tea but it still came for me so fuck u,0.049989145,0.08856395,0.4195425,0.57787937,0.8907955,0.9288007
