instance_id,text,IDENTITY_ATTACK,THREAT,SEVERE_TOXICITY,INSULT,PROFANITY,TOXICITY
117414,Useless fucking piece of shit,0.1508922,0.024753258,0.61260825,0.9028068,0.9621428,0.9880789
15714,I LOVE SOUDA SO BAD SHUT THE FUCK UP,0.056582913,0.048481647,0.45895407,0.6306599,0.90150756,0.9248995
106111,Lol these women on th tl go crazy over dumb shit,0.46028158,0.019228047,0.35368225,0.7218519,0.844891,0.91625386
45814,""" you do not give a shit. stop pretending, stop lying. cause to you I’m just a check bitch. just a dollar sign",0.17070955,0.061736204,0.5188304,0.7804726,0.8949436,0.9288007
65211,man y’all KPOP STANS ARE ON SOMETHING BRO. stg this shit mad creepy and y’all in the comments supporting this? oh hell nah and y’all wonder why no one like y’all dumbass.,0.37655997,0.05914995,0.50703704,0.7657292,0.7809412,0.911035
10116,And i hope scum like you stay the fuck away from my sacred European homeland,0.49032792,0.13397428,0.45895407,0.7775208,0.84506536,0.911035
119520,this hard-ass mothafucker fought WWII armed with nothing but his longbow,0.28034934,0.13815513,0.50703704,0.7218519,0.90258646,0.93383175
141917,A nigga be tired of bipping 5th wheels and shit,0.7895903,0.038911607,0.35368225,0.69164425,0.8449782,0.9061063
429,If ur a procrastinator plz fuck off and stay as far away from me as possible,0.13591312,0.077831104,0.45895407,0.6149945,0.84506536,0.9061063
6920,WHAT THE FUCKING SHITFUCK NIGGER BACKWARDS ASS THINKING CAN PROPOSE THIS AS A SOLUTION YES I'M FUCKING MAD.,0.8330005,0.13700877,0.61476606,0.8390655,0.9421618,0.9749944
146119,"Hmmm, so youre saying you cant assume peoples political preferences based off a single sentence? Youre a fucking douchebag hypocrite",0.10221587,0.015947454,0.45895407,0.87225974,0.8802007,0.9288007
12075,melissa hastings is a bitch🤧,0.23467018,0.012078222,0.35368225,0.8012121,0.8086746,0.9061063
67315,Juicy Couture Sunglasses Female 503/S - Black - 56MM #Bags&amp;Accessories #Clothing,0.1508922,0.011456826,0.44713756,0.83943826,0.8326356,0.9209984
48211,Damn this sub! Had to get it.,0.031980325,0.037530303,0.4583481,0.6675394,0.89909166,0.9288007
48223,What in the complete fuck is going on here bitch....,0.11047905,0.04201601,0.51028454,0.78882504,0.9540331,0.968226
16779,there is going to be something batshit crazy related to this bitch in the future. bitch is a time bomb.,0.22783615,0.34864578,0.4561839,0.8012121,0.87472564,0.9248995
167720,Go fuck yourself . We pay for the NHS . We stop smoking there will be no NHS .,0.052035484,0.0824309,0.45895407,0.67735565,0.86331284,0.9209984
136018,To be called JIDF or a shill you must be doing some really stupid and suspicious shit.,0.2308735,0.012026439,0.34938923,0.7762574,0.8326356,0.90451443
162122,start running away like a dumb ass,0.060675595,0.029933142,0.34989303,0.7922567,0.80158395,0.9248995
42520,a kebab is still a kebab despite the size of his wallet. fucking faggot is probably funding some terrorist group anyway. also i don't need some cocksucker trying to convert me to his shit-skin religion. No.,0.6990888,0.079364374,0.50703704,0.7827088,0.87472564,0.9061063
14798,My penis is bigger than yours.,0.044870727,0.010447056,0.26195827,0.42567953,0.7181329,0.911035
10236,Seriously y'all my fucking head,0.053854458,0.013702838,0.35368225,0.5739874,0.90862066,0.911035
102315,Ohhh we have bastard racist white folks just like modern day America. We did not need to import that bullshit from America 50 years ago.,0.7426507,0.02924249,0.45401973,0.7497506,0.8117245,0.90451443
74112,to the dude who likes me in class STOP IT U FUCKING HEADACHE ATOP ANNOYING THE SHIT OUT OF ME YOU FUCKING JACKASS,0.23542951,0.0824309,0.61260825,0.802824,0.91513264,0.96426713
16614,Don’t talk to me with a fucking kindergarten or a backwards mindset like this &amp; expect me to treat you seriously when you yourself retweet pornography &amp; have your dp anonymous. Don’t be fucking entitled and misogynistic. Now get out of my mentions I’m intolerant of stupidity,0.27759558,0.12996206,0.52737635,0.7218519,0.84995824,0.9248995
72810,OBEY ME YOU FUCKING TINY FAGGORT FUCKS DADDYS HERE NOW!! SERVE ME! 😏🐷💸💸 #cashmaster #findom #gay #slave #paypig #daddy #alphafindom,0.6458014,0.34804323,0.6552761,0.7775208,0.8949436,0.91625386
11157,im DISGUSTED. those children are fucking CRYING and no one is paying attention. security took TOO fucking long to show up. what the fuck,0.062039822,0.018364733,0.45895407,0.5130944,0.8855216,0.911035
152415,#FUCK THE DH sorry not sorry,0.06522302,0.044602267,0.45895407,0.4339631,0.8855216,0.9061063
11538,Get the fuck out Multiculturalist pig.,0.6928741,0.13815513,0.49764585,0.8032227,0.90258646,0.95048624
70411,Get a mother fucking job you broke ass bitch instead of complaing about why you broke 😩😩,0.19890837,0.13815513,0.61260825,0.7090544,0.8449782,0.944597
92119,"You mother bitch, motherfucker",0.28034934,0.04098356,0.61476606,0.9335635,0.9621428,0.9817629
35813,fuck you guys and your DLC weapon shit. Stop ruining call of duty,0.18705739,0.1329628,0.5552179,0.71551245,0.9342644,0.9749944
137115,This fucker deserves everything bad in the world,0.23467018,0.3490162,0.45895407,0.7418356,0.90150756,0.944597
11520,Stop peddling this fucking lie you uneducated ignoramus.,0.14019285,0.033386398,0.45895407,0.84251964,0.90150756,0.944597
127322,"Or you're just a fucking idiot that believes all the stupid ass articles that come out saying ""mk11 is full to the brim with microtransactions""",0.11860296,0.020091362,0.50703704,0.8987166,0.92389363,0.96426713
65621,Corbyn the evil dirty fuckung Traitor of the UK No good person should vote for him now give Corbyn this  👢👢👢👢👢👢👢👢 A bag of 💩,0.36702603,0.11002964,0.50703704,0.78565484,0.7809412,0.91625386
66511,First we lost #TonyStark and #CaptainAmerica Then we lost #Daenerys while #GoTs8 makers lost plot And now we lost #CricketWorldCup2019 Year 2019 - you suck!,0.8182097,0.10696311,0.5188304,0.6798578,0.92389363,0.9563754
2445,This video also looks super fucking fake.,0.10221587,0.012233571,0.457266,0.5130944,0.8449782,0.9248995
143610,"fuck nudes, send vm's instead.",0.2783691,0.09009721,0.35368225,0.5130944,0.84506536,0.9029226
143611,Go back to painting your little warhammer figurines you pathetic virgin faggot.,0.6220118,0.056563694,0.45895407,0.84251964,0.7809412,0.91625386
8191,Killa 2020 : youse a fucking cunt,0.2127345,0.016465442,0.5188304,0.83943826,0.9342644,0.96069145
10575,Operator: DO CPR OR JUST LET HIM DIE HAHAHAHA me : BITCH WTFFFF,0.23163283,0.5940531,0.50703704,0.6308392,0.73341435,0.90451443
66321,"When you prayed to lucifer for gay men did you ever think about "" Reap what you soww"" of course you didnt Jezebel. Dumb ass.",0.5707127,0.025789235,0.35368225,0.8012121,0.7107322,0.9029226
87011,Fuck of you vile warmongering racist. No need to go into detail but will mention Iraq and Michael Howard,0.46028158,0.11002964,0.45895407,0.78565484,0.8449782,0.91625386
7801,Shut the fuck up and learn some perspective,0.06431354,0.040638234,0.45895407,0.6677319,0.91513264,0.944597
58813,Now I’m verifying all my food when I shop only buying shit that is metal sealed!! You nasty fucks,0.12735364,0.019918699,0.45895407,0.7418356,0.89909166,0.9391453
86117,I made your nigger fucking ass a swing. If I saw you in real life,0.80378765,0.2836219,0.54893947,0.78882504,0.9205162,0.9563754
21819,Me: *At work* All the porn i was looking for on my timeline:,0.08170113,0.009074804,0.3494667,0.7418356,0.85672,0.911035
389,Lesnar is the world's biggest bitch,0.28034934,0.010602405,0.35368225,0.802824,0.8449782,0.9209984
14771,The servers are fucking broken you morons. Ps4 of and switch. I used the PS4 and switch in 2 different locations in 48 hours. Low ping spikes and rubber banding. It's fucking broken,0.14019285,0.03718498,0.45895407,0.72756535,0.90258646,0.944597
151511,NO NO NO NO NO THERES NO WAY YOU CAN POSSIBLY UNDERSTAND HOW A BLACK PERSON FEELS IN THIS OPPRESSED SOCIETY CHECK YOUR PRIVILEGE YOU RACIST PIECE OF SHIT,0.6220118,0.06755528,0.50703704,0.802824,0.84506536,0.944597
151515,What the actual fuck is wrong with y’all,0.07673789,0.014393489,0.35368225,0.49389273,0.87472564,0.9029226
89513,All these supposed funny or joke subs are full of fucking whack racist shit like this. Grow the fuck up already!,0.39677486,0.063029334,0.5614964,0.7762574,0.92389363,0.96069145
51811,Shit ass you’ll regret it one that one booter fucks your Routers,0.10221587,0.13717735,0.50703704,0.5678696,0.85672,0.9288007
59918,#Neil Custis fuck me your shite at this journalism lark ain't ya,0.24293575,0.13768311,0.52891463,0.6120431,0.85672,0.9248995
125816,Curtis is such a fake bitch. #LoveIsland,0.20878418,0.013372798,0.35368225,0.82974654,0.8117245,0.911035
37317,Currently hml. Fuck off everybody,0.10235514,0.06626215,0.45895407,0.5739874,0.90150756,0.93383175
4407,I don't love Robb. He was a fucking idiot.,0.1294935,0.010938995,0.35368225,0.91372794,0.902047,0.9563754
137214,Fuck Mercury. Bitchass mercurial hoe ass planet. You ain’t fuckin’ with me.,0.28034934,0.065292306,0.61260825,0.71551245,0.94929975,0.9563754
243116,Bryce is slumping like a motherfucker god damn Dude has had like 2 multi hit games in the past 3 weeks or something,0.089973204,0.013579931,0.45895407,0.6407567,0.87472564,0.9209984
30099,"She ain't naked, fuck you talking about inappropriate",0.06385879,0.05236103,0.35368225,0.53014356,0.8326356,0.911035
31238,Miss me with that gay shit,0.7115778,0.012699619,0.3536391,0.65129566,0.86331284,0.9061063
256217,"Just tweet to remove them, your ideas are actually autistic and ruin the fucking game",0.3072352,0.0475118,0.45401973,0.6500014,0.86331284,0.91625386
302121,In 5 mins God will Forgive me. Fuckx You Satan.💯🖕.,0.23391083,0.27637172,0.52891463,0.6991143,0.8949436,0.90451443
212913,Whoever wrote that is fucking retarded or a master propagandist.,0.37361985,0.014393489,0.44787344,0.8012121,0.84995824,0.9061063
284311,The only thing I fetishize is you getting hit by a bus in front of your family. Eat shit.,0.16373143,0.52468014,0.45895407,0.68668073,0.8907955,0.95048624
251714,Nah people can suck my dick. I’m doing what I want for MY wedding,0.09741807,0.02855184,0.44969136,0.36798462,0.8186401,0.9029226
362516,no wonder he got kissed twice...... bitch came out looking like a whole flynn rider... fuck you,0.18313584,0.06690872,0.45895407,0.7497506,0.89909166,0.93383175
263513,That shit is fake. That nigga always putting out these kind of vids.,0.84706575,0.043309137,0.50703704,0.8032227,0.8949436,0.96069145
32157,i hope a car froggers your ass,0.05976611,0.5195707,0.35368225,0.5072643,0.759977,0.9029226
253315,"""youre fucken welcome for this content biiiiiitch"" me every time i say some dumb ass shit on here",0.17381613,0.03165977,0.45895407,0.71120167,0.94929975,0.944597
310317,I posted my response well before you edited yours into a wall of text. Yours was initially just a paragraph. Fuck outta here.,0.08500996,0.055270568,0.45895407,0.6120431,0.86331284,0.911035
344912,Nigga you got no idea how dumb this shit was,0.7895903,0.024753258,0.45895407,0.83943826,0.89909166,0.96069145
344923,United are fucking pathetic,0.31892163,0.010214032,0.35368225,0.7065844,0.902047,0.9248995
35177,Fucking balloons you fags should learn to leave such things to professional you know genticlly suppirior thinkers and fighters,0.7426507,0.07476458,0.52891463,0.7775208,0.8802007,0.9391453
30876,Fuk u this post made by the Persona 4: the console owners gang,0.10221587,0.042662576,0.45895407,0.6407567,0.8449782,0.9209984
296813,I didn't have the heart to tell her that I don't fuck white women who have fucked spic mexicans,0.81666446,0.051391184,0.45895407,0.71120167,0.902047,0.9391453
296816,This idiot needs to share a cell with said drunk driver. Fucking joke.,0.08583717,0.046541955,0.35368225,0.87506694,0.86331284,0.9391453
25768,ive handled too many mood-swing bitches if there's another one imma kill my self,0.32476485,0.6943677,0.45895407,0.6051471,0.7888968,0.9061063
326813,I just miss your presence fuck the rest of the shit .,0.039714564,0.025271246,0.35368225,0.4718924,0.91513264,0.90451443
32188,Fuck that bitch I don’t trust that bitch .,0.19693321,0.077831104,0.5520787,0.83943826,0.9342644,0.968226
321811,Jews are seen as snakes and theiving fucks who should never be trusted,0.8182097,0.14169718,0.46477664,0.7344449,0.79449326,0.9029226
282118,Does that type of shit get you off? Wtf is wrong with you?,0.040745795,0.012751401,0.34950548,0.5678696,0.89909166,0.90451443
293212,Do your fucking job and stop whining.,0.029144434,0.014393489,0.35368225,0.6051471,0.89909166,0.90451443
293213,"Um, no to US being Likud’s proxy. Fuck you.",0.1015541,0.04029291,0.35368225,0.65129566,0.8855216,0.911035
286220,never needed a nigga for shit 😊,0.8182097,0.029069828,0.45895407,0.72756535,0.85672,0.91625386
324214,yall going to fucking jail,0.10221587,0.27637172,0.42874086,0.5130944,0.8907955,0.9288007
303216,how can I stop this fucking bullshit? I fucking hate it,0.05612817,0.02492592,0.4195425,0.48569724,0.9540331,0.95048624
306216,it’s not an addiction until you’ve sucked dick for it,0.04177703,0.012958534,0.35368225,0.46476576,0.84995824,0.9061063
280913,if y’all are mean to old people!!!! u suck!!!!!!,0.2308735,0.039602257,0.45895407,0.71027446,0.70864636,0.9248995
226919,Acting like this is a bad thing. Maybe if your parents had spanked your dumb ass you wouldn't be such a fucking mess today.,0.14661247,0.28890648,0.45895407,0.7298119,0.89909166,0.9209984
24175,Mother Nature is a bitch!,0.22063516,0.010680079,0.3494667,0.72756535,0.8690192,0.90451443
319612,They look for any excuse to display their hatred of black people. Just wear that shit with pride and stop hiding behind bullshit. Quit being a bitch.,0.5948528,0.023544617,0.45895407,0.83943826,0.91513264,0.944597
301918,the universe is one crazy bitch,0.23467018,0.010628296,0.33047765,0.71120167,0.8690192,0.90451443
339519,stupidest Blackout map ever! It’s fucking dumb as shit.,0.16801116,0.0104988385,0.45895407,0.71027446,0.9342644,0.96069145
23035,"Yeah, stirred up shit for nothing. Didn't bring anything good for kid. But ""adults"" are also fucked up.",0.0775651,0.013010317,0.34954423,0.5130944,0.91513264,0.90451443
350616,bitch ur breath smell like pure pressure,0.09576365,0.028379176,0.35368225,0.6675394,0.83974665,0.90451443
32605,Get fucked in the showers ma’am,0.10221587,0.094697006,0.4011458,0.5393265,0.8690192,0.911035
356420,The BAILED LIKE A FUCKING BITCH.,0.21866,0.020954676,0.5145575,0.84251964,0.95876634,0.96426713
370714,"Bitch... I activated my FB so I could get these pics of me and my mama and ran into every single pic of me and Lyric. I gotta clean this bitch out my life. Not to call her a bitch, cuz I almost married her, but... u know. Triggered. I deactivated that shit so fast",0.28034934,0.1366716,0.45895407,0.7418356,0.902047,0.9288007
226719,"You #liberals are just a bunch of freaking privileged morons, yes privileged, you know why? Because you live in America. You should go to a socialist country to try what you preach instead of destroying this geeab country, fuckers!.",0.55044734,0.064969026,0.45895407,0.8082062,0.8255558,0.90451443
31705,for those of y’all who haven’t read the attack on titan manga ima say one thing... fuck this bitch named gabi,0.19693321,0.13815513,0.45895407,0.7065844,0.8949436,0.9288007
259116,Yep. pirate their movies. fuck this company.,0.089145996,0.05947323,0.35368225,0.5129801,0.86331284,0.91625386
310115,hahah fucking confirmed for poof cunts,0.25647953,0.021645326,0.47886345,0.6677319,0.90862066,0.944597
310118,"You stupid piece of shit are you suggesting that because you see ""emotion"" in a play or movie then that means its real? It's been proven false due to numerous inconsistencies and logical impossibilities in the story . Kill yourself shithead.",0.2816105,0.60325533,0.61260825,0.9100384,0.8855216,0.968226
241219,"You're appealing to take others' civil rights, you drooling fucking idiot",0.1508922,0.016292779,0.45895407,0.9045387,0.91513264,0.96069145
291711,Get out your feelings bitch,0.10221587,0.043309137,0.35022295,0.7827088,0.86331284,0.911035
296520,"fake ass imam, ITS JUST A JOKE DAMN",0.2949366,0.05721026,0.45895407,0.6308392,0.8186401,0.93383175
267219,Black women are disgusting monsters that need to shut their damn mouth,0.84706575,0.1575099,0.5231034,0.8685752,0.7673477,0.95048624
364016,You absolute mother fucking pieces of garbage for making this:,0.24970764,0.043955702,0.6135751,0.87896585,0.927271,0.968226
317517,drink a shit everytime ece thinks about levi's swalla vid,0.08087392,0.10389658,0.35515398,0.48675314,0.8089582,0.9061063
32639,#BoycottHomeDepot Twitter is really fucking gay!,0.7856228,0.018364733,0.45895407,0.6831271,0.8255558,0.93383175
28647,I dont draw nsfw because what the fuck is a penis,0.08500996,0.010110466,0.35220072,0.46173862,0.90150756,0.93383175
286422,fuck the whole education system,0.08666438,0.032695748,0.35368225,0.40243408,0.902047,0.91625386
286711,What the hell you domb ass,0.120924085,0.032695748,0.4195425,0.7497506,0.8326356,0.9209984
293010,I mean I'd have no choice but to rip those leggings off and fuck you,0.06749674,0.49142194,0.44969136,0.5678696,0.8949436,0.9288007
251212,FUCK THIS SHIT! HIT ON WOMEN! IF THEY DONT LIKE IT HIT ON THE NEXT ONE!,0.44690517,0.54744303,0.61260825,0.6500014,0.92389363,0.968226
246017,want to fucking punch myself,0.07425626,0.60325533,0.45895407,0.47273466,0.84995824,0.93383175
213221,"Dude get that sexist bullshit out of here. Its uncalled for, untrue, and just points out that you are clearly a a huge dick.",0.2774022,0.02492592,0.45895407,0.78882504,0.8802007,0.9391453
231121,Africans are so god damned stupid.,0.84706575,0.019573374,0.45895407,0.87506694,0.844891,0.96069145
314720,"MA CRY WITH ME 😭 I WAS FUCKIGN PLAYED BY A BTCH WHO WANTED CLOUT,, FUCK 🔫",0.099072486,0.053007595,0.50703704,0.5678696,0.89909166,0.9209984
305218,bitch said she wants her boys to look as skinny as spaghetti.... if u don’t go fuck the entire pasta isle at whole foods n STOP with that clownery.,0.37012735,0.13498579,0.45895407,0.64537907,0.77181685,0.9029226
297221,u mad faget? u mirin superior islamic moral codes? u want more authentic quotes to blast ur anus?,0.6007182,0.34804323,0.50703704,0.7657292,0.8086746,0.91625386
258212,Allow me to be the first to tell you to fuck right the fuck off. Seeking asylum is NOT a crime. And fuck your 'give a shit button' it's called empathy asshole. And I've got more empathy for these assylum seekers than I have for your willfully ignorant ass.,0.28034934,0.08856395,0.5188304,0.78565484,0.927271,0.944597
271019,Whoever got my lighter from Saturday........ 🖕🏽🖕🏽🖕🏽 fuck you,0.04951127,0.039947584,0.45895407,0.6500014,0.89909166,0.93383175
250523,Ain’t nobody in my life more negative than my damn bank account. Like fuck be postivate sometimes with yo ugly assss.,0.10221587,0.02371728,0.44787344,0.6677319,0.8949436,0.91625386
363116,"? the fuck? lol nah trans people wanna be equal and shit but they separating themselves from everything. Any person at any suicide hotline is trained pretty heavily, unless you're a trans person wants to die for the same reasons anybody wants to die",0.6106996,0.34804323,0.45895407,0.5678696,0.844891,0.911035
33356,"Aye bro, please shut the fuck up. No one cares",0.052944973,0.04524883,0.44787344,0.67735565,0.90258646,0.93383175
211711,SHOULD I GIVE YOUR MOM A MOTHER FUCKIN HOLLA,0.109318495,0.13515437,0.5145575,0.65129566,0.8907955,0.91625386
324816,Of course they did he really is one sick ass son of a Bitch 😤😤 😠,0.22935481,0.06820184,0.50703704,0.7782364,0.7654259,0.91625386
35521,To the person who doesn’t know how to drive and HITS a parked car.. Fuck You.,0.043581683,0.22514746,0.44787344,0.6677319,0.8855216,0.93383175
328718,"i hate subbing at new schools bro, kids swear that’s the ok to act a fucking fool lmfaoo luckily they got the right one cause i don’t play that shit",0.2783691,0.017674083,0.41034412,0.54471385,0.8326356,0.911035
34455,Did I say you blocked me? The person whose post I actually commented on did. Get off my dick.,0.06658725,0.04132889,0.35368225,0.56997263,0.8186401,0.9061063
360114,WHAT THE FUCK ARE YOU DOING!!!,0.022791367,0.013702838,0.45895407,0.5130944,0.8949436,0.9248995
30471,I tell someone to suck a bag of cocks daily.....stress relieving utterance....,0.038425524,0.025443908,0.3735507,0.44464502,0.8086746,0.9029226
31687,So? Little piece of shit deserved it.,0.07012023,0.09776353,0.35368225,0.75027496,0.8802007,0.91625386
232011,yet still society goes to shit. Might makes right is shit. Face it buddy,0.099072486,0.011741633,0.25624833,0.5332045,0.90258646,0.9061063
295114,that cheating shit and messing with multiple people shit is lame..im grown,0.07591068,0.021472665,0.45895407,0.54525656,0.902047,0.9288007
255920,god you cultural marxists are fucking stupid,0.5108175,0.015774792,0.45895407,0.87225974,0.91513264,0.96069145
212717,"FUCK YOU!!!! I just seems like pricks, but that's been together a clown obsessed with every character I was written in the",0.1035157,0.06863153,0.56375664,0.7762574,0.91513264,0.96069145
229916,Fucking liberal dipshits always trying to ruin a good moment for the rest of us.,0.5485698,0.03718498,0.45895407,0.802824,0.91513264,0.944597
334120,You guys are taking this too far fuck you,0.06249457,0.06690872,0.45895407,0.6120431,0.8855216,0.9391453
210611,This business is genuinely fucking stupid. Oh my god.,0.06431354,0.008453408,0.35040274,0.66500133,0.89909166,0.91625386
22341,Sometimes its one set of fucked up assholes against a slightly less fucked up set of assholes,0.18002926,0.01698343,0.45895407,0.7298119,0.927271,0.9391453
24921,And I also bring you everywhere everytime you ask. Like bitch you can’t talk shit on me. 🖕🏻🖕🏻🖕🏻🖕🏻,0.10221587,0.13532294,0.45895407,0.71120167,0.8117245,0.9061063
28698,Like wtf half of the mother fucking com just signed it Recrut this mf already wtf,0.10221587,0.035113025,0.5145575,0.5739874,0.8949436,0.93383175
30241,"fuck just look at her face what you think shes thinking? "" i dont want to look black",0.7426507,0.07246469,0.45895407,0.57566804,0.78491896,0.91625386
302411,You idiot. The academy is already adding it to every category of their list and you're out here saying this rubbish.,0.051808115,0.011146127,0.16960317,0.88346136,0.46460027,0.9061063
209016,"""aptitude for logistics"" bitch i'll kill you",0.27701542,0.8871364,0.61260825,0.71120167,0.84995824,0.968226
303119,"i will “girl, fuck you” in a heartbeat",0.1444726,0.34804323,0.4379392,0.54471385,0.8907955,0.9029226
293918,Stick your double-standards up your ass.,0.035589635,0.063352615,0.25053838,0.5130944,0.77181685,0.9061063
238611,holy shit cuphead show holy shit cuphead show,0.05794714,0.01086132,0.35368225,0.5130944,0.89909166,0.9061063
319219,NOBODY FINNA TELL ME LOVE SICK IS ON NETFLIX?!?! my bitch ass is on these janky ass websites trying to find full episodes with eng sub like a fool.,0.19298288,0.035458352,0.45895407,0.56997263,0.844891,0.91625386
30177,Bruh you a grown ass fucking man smh,0.15731181,0.014220826,0.45895407,0.7218519,0.90150756,0.91625386
358222,god damn windows 10 fucking with wacom drivers im furious,0.06522302,0.021472665,0.45895407,0.4339631,0.90862066,0.93383175
347821,"when we get the hd version of this look its over for you bitches. its me, im bitches.",0.28034934,0.06755528,0.35368225,0.7344449,0.86331284,0.9029226
208123,Skintone COME FUCKING THROUGH BITCH YES GO OFF,0.14019285,0.13815513,0.61260825,0.6991143,0.90258646,0.9563754
29948,you always on some ill shit so DO NOT text me,0.072601855,0.018364733,0.35368225,0.57566804,0.8326356,0.90451443
299422,Literally have no fucking motivation for anything. Fuck life,0.030949092,0.012906751,0.35368225,0.42367843,0.9540331,0.9209984
355023,"Stupid iPhone users cant even listen songs without buying, cant insert SD CARD, once you accidentally lock that sheet phone you cant use it anymore the system sucks also once crack the screen either buy new phone than repairing, iphone my shit",0.37082586,0.03649433,0.45895407,0.75027496,0.8089582,0.944597
368414,Like real older women and bitches that understand that shit 😂,0.46028158,0.022163315,0.35368225,0.68668073,0.8802007,0.9061063
26806,landlords are the scum of the fucking earth,0.37082586,0.012233571,0.4195425,0.7967344,0.902047,0.9288007
21451,parents be like: i truly don't give a shit that i've created your deepest insecurities about yourself 🤪 deal with it bitch !,0.16993292,0.043309137,0.4561839,0.7497506,0.87472564,0.9209984
214521,You are shitting me. Man this sucks.,0.043581683,0.009359611,0.35368225,0.5130944,0.90258646,0.9248995
220412,FUCK YOUR COLD TREATMENT!,0.028886627,0.016120117,0.3735507,0.46625584,0.87472564,0.9029226
220414,that shit is fucking gay and stupid,0.8857684,0.03649433,0.6224206,0.91372794,0.96028095,0.9940395
25159,BITCH HELL YES I FUCKING DRAGGED THAT BLOODY GOAT AHAHAHAHA,0.16993292,0.40348873,0.61260825,0.6370372,0.91513264,0.96069145
251523,Whyyyy? Fucking people disgust me 🙄,0.15303208,0.017156094,0.45510182,0.5739874,0.85672,0.9209984
292216,"dudee please stop spamming my shit, I fuk with u but chill brah",0.09576365,0.114629425,0.44787344,0.5130944,0.8690192,0.9029226
292217,"Wheres my other goddamn pinned. And fuck off, skully. I never want to see your arrogant ass again. ""Humanity's the one that did this to me"" Oh there you go again, blaming ither people for YOUR actions. Fucking moron.",0.17925262,0.07629784,0.50703704,0.87225974,0.9205162,0.9563754
346316,i wonder how it all started... probably stoopid shit,0.031206898,0.008893564,0.2322463,0.6109131,0.8802007,0.9029226
