instance_id,text,IDENTITY_ATTACK,THREAT,SEVERE_TOXICITY,INSULT,PROFANITY,TOXICITY
113516,Wow what a C**t you ARE. But your mom loves black cocks,0.5707127,0.022163315,0.50703704,0.7418356,0.844891,0.944597
8216,Is it the white rose of Athens?,0.57150364,0.048481647,0.50703704,0.6798578,0.8907955,0.9391453
71615,So sick of people correcting you. It's fucking stupid.,0.052490227,0.009126588,0.35368225,0.7492263,0.902047,0.9288007
8598,😂 a wholeeee fucking idiot,0.099899694,0.0116639575,0.45895407,0.88346136,0.92389363,0.96426713
8538,FUCK SEASON 3 OF STRANGER THINGS. Y’ALL DIDNT HAVE TO DO THAT,0.04177703,0.018710058,0.45895407,0.40243408,0.8802007,0.9288007
85318,I MADE CRYING NOISES AND MY KITTEN JUST SMACKED ME IN THE FACE FUCK THIS DUDE 😭😭😭,0.08252834,0.34804323,0.45895407,0.49389273,0.7785769,0.911035
38823,"Who is the dumb fuck that comes up with this shit. Is is Magic Mushrooms, LDS, Tide Pods or Blowfish. Men, real men, not the man bun wearing libtards would even give this as a gift it's so assisnine",0.2949366,0.05236103,0.45895407,0.7418356,0.902047,0.9288007
111816,knock the fucking shit out of them,0.10221587,0.34926313,0.35515398,0.54471385,0.92389363,0.9288007
56011,If you spoiled it I'm gonna fuck you up Joke,0.10221587,0.54744303,0.46477664,0.54471385,0.8449782,0.9248995
2779,"bitch im crying, pose got me fucked up",0.07094744,0.029933142,0.35368225,0.4596616,0.91513264,0.90451443
129520,will is so fucjing annoying bro shut UP,0.083355546,0.04029291,0.45895407,0.6407567,0.7796426,0.9029226
74515,When I found out Rob was gay it blew my mind. Then when I came out it made me doubly happy because they're my favorite metal band. METAL GOD,0.1232452,0.020436687,0.45895407,0.71120167,0.9421618,0.96069145
139410,I fucked my penis because it diddled Bob.,0.039714564,0.01254427,0.3735507,0.32211447,0.8949436,0.9391453
2517,"And then these fuckers want me to call them ""heroes",0.16159154,0.025271246,0.35368225,0.65129566,0.86331284,0.9029226
130013,assigned middle-school bullshit like a fucking Pinterest board about how you want to be perceived and your identity,0.052944973,0.009981008,0.35368225,0.47384647,0.90862066,0.9029226
159621,"Yeah, right. You’re an idiot",0.04203484,0.008440462,0.13599765,0.9045387,0.5249258,0.911035
49318,hey fuckers ive been tier 3 all fucking day when is it gonna go up,0.073429056,0.017674083,0.45895407,0.58196646,0.92389363,0.9248995
32312,fucking hell the fuck is this,0.028418748,0.014738814,0.45895407,0.44802538,0.9540331,0.96069145
118918,you niggas and bitches are shiesty asf bruh no cap . no loyalty whatsoever .,0.8386719,0.05042134,0.5520787,0.8634578,0.8690192,0.9391453
74918,"""Being the villain is fun and all but my true passion is helping others~"" 🍄 Extra Thick 🍄 Can Be Futa 🍄 Switch - Moslty Sub 🍄 Bisexual - Futa Lean 🍄 Never Takes Off Her Mask 🍄 No Limits 🍄 Ask Before DM 🍄 Owns A Potion Shop (RP)",0.09410924,0.020609349,0.35368225,0.7418356,0.85672,0.9029226
8186,"I mean, how fucking stupid do you have to be for this come out of your mouth? No wonder we’re in such a damn mess.",0.062039822,0.014393489,0.45895407,0.8502231,0.90258646,0.944597
81814,fuck someone take me off this world with this stupidity.,0.052035484,0.02855184,0.35368225,0.5739874,0.91513264,0.9391453
81820,Fuck anybody that's been begging for this hot musty ass weather 😤,0.10221587,0.122295745,0.45895407,0.5015486,0.8255558,0.9061063
9596,Damn snoop finally turning into one of them negative ass old niggas 😞,0.7426507,0.048158366,0.45895407,0.71120167,0.7809412,0.9029226
102622,They would have have to cut my tongue out your asshole,0.13163337,0.56065804,0.45895407,0.68668073,0.87472564,0.9391453
80520,me: i love you molly: i fucking hate u dumb bitch,0.30256465,0.035458352,0.44713756,0.8634578,0.92389363,0.9391453
8101,Ready to get out this bitch,0.18158256,0.23696843,0.3536391,0.7497506,0.83974665,0.9061063
27413,"i def double text &amp; don’t give a fuck, you gonn reply to me bitch 🤣",0.12556632,0.11309616,0.45895407,0.7492263,0.902047,0.9248995
97515,Assad is fucking sectarian scum that's why. He's no left wing saint. I wish people would stop touting this murdering neolib as a leftist hero. He's dispicable,0.49855098,0.146441,0.45895407,0.8012121,0.8255558,0.9061063
118010,Dude g shit fuck that person that's so fuckin disgusting that ppl are literally so hateful that they'd say and do shit like that man wtf,0.18235919,0.11616269,0.61260825,0.7418356,0.91513264,0.96426713
6286,Bad bitch sucking on my green nuts 👏 👏,0.23846684,0.06755528,0.5145575,0.65865606,0.8089582,0.9209984
6035,Then this bitch spitting in SWEET TEA 😡😡,0.1714862,0.060119797,0.45895407,0.64537907,0.7246992,0.9029226
67412,"You cannot combine? Nice contributing to the erasure of black queer women, asshole",0.77072054,0.1319513,0.45895407,0.78882504,0.8086746,0.91625386
126712,Hot mom fucks teen chumly Family Competition,0.21866,0.03407705,0.50703704,0.5130944,0.84506536,0.91625386
47612,You REALLY have to be an idiot (or just a nigger looking to blame anyone but your own people) to believe that it wasn't Africans and the arabs/muslims that sold these fucks down the river.,0.7895903,0.046218675,0.45895407,0.802824,0.8089582,0.9061063
47616,What the fuck is this shit,0.02821777,0.008841781,0.35368225,0.46923602,0.95876634,0.95048624
129816,if you’ve yelled at someone for not standing for the pledge (or the fucking star spangled banner) you are a piece of shit,0.10815793,0.024235269,0.44860926,0.83943826,0.92389363,0.944597
16321,Go read a history book you dumbshit.,0.10221587,0.015947454,0.35368225,0.8685752,0.85672,0.9288007
44514,"You are all a bunch of clowns trying to make every last dime out of 2 kids death. Fuck you, you greedy pricks.",0.24970764,0.41623402,0.50703704,0.87896585,0.90150756,0.9563754
132614,what am i? a fucking idiot sandwich,0.04177703,0.009230154,0.34966052,0.7065844,0.9421618,0.9288007
93412,"I don't care, bossy b!tch.",0.10221587,0.020782012,0.35368225,0.75027496,0.84995824,0.90451443
15406,IDIOTS READ A DAMN NEWSPAPER,0.105836816,0.01750142,0.35368225,0.8032227,0.7181329,0.9061063
26013,Shut the fuck up Lindsey.,0.089145996,0.050098058,0.4379392,0.7065844,0.90150756,0.9248995
26019,"well when ur an elder like moi, you do things (don’t have sex until ur legal kids)",0.06249457,0.012130005,0.35368225,0.7775208,0.8802007,0.9029226
15677,fuck that im not helping you fuck a nigger,0.8443434,0.13815513,0.61260825,0.8685752,0.94929975,0.9817629
118517,"What the fuck, even if used for it's intended purpose you're still pulling toilet paper out of a dog's asshole",0.094936445,0.02924249,0.45895407,0.6308392,0.927271,0.95048624
12816,Rosenbaum's muh free market is nearly as bad as Marxism.,0.04177703,0.012854968,0.35368225,0.5072643,0.90150756,0.9288007
128120,Go... NOW &amp; Take that peice of shit Mr Ed with you 😠 😠 😠,0.11744241,0.11002964,0.45895407,0.6308392,0.7785769,0.9061063
12517,"Bitcoin will never go up! Suck shit"" ",0.06249457,0.014393489,0.45293763,0.5935568,0.90862066,0.9288007
125113,Do you enjoy having your innocent jewish ass being ravaged by my hard jew cock?,0.7426507,0.34804323,0.5552179,0.7090544,0.8855216,0.95048624
40220,I don’t hate white men... but white guys are fuckin retarded! Right black-trans-Muslim-queer-autistic ladies?,0.8682002,0.114629425,0.56375664,0.8082062,0.8326356,0.9391453
10935,this bitch throwed off lmfaoooooo,0.20878418,0.13313138,0.45895407,0.7298119,0.844891,0.93383175
47416,Then do it you fucking liar,0.10221587,0.023026628,0.44787344,0.8579266,0.91513264,0.944597
5109,Another bullSHIT ploy to buy time! Traitor to USA Barr works for fuhrer FELON DICKtator &amp; will protect his interests 1st above &amp; before anyone else!!! 👎👎👎👎💩👎👎👎👎,0.28034934,0.06820184,0.50703704,0.6831271,0.764141,0.9061063
22423,This person should be banned and so should the media for actually even putting this out fuck outta here 5-0 in this bitch and 20 seasons on one team gtfo,0.2028587,0.1319513,0.45895407,0.65231085,0.8255558,0.90451443
7351,The literal scam bro the fucking scam just steal a car,0.060220852,0.021645326,0.35368225,0.5678696,0.85672,0.9061063
7358,Oh my god fuck off if you This out,0.06431354,0.043309137,0.45401973,0.54471385,0.87472564,0.911035
73511,Why are you calling me a hoe,0.10221587,0.010757755,0.44787344,0.89108896,0.90150756,0.9563754
73513,Stfu and let me beat your ass in iMessage games.,0.078392304,0.53875744,0.44969136,0.5423875,0.8089582,0.91625386
113118,Idiot . Plenty of non citizens live here legally . Trump is a Dumbass,0.19890837,0.011922873,0.3361876,0.9028068,0.5711371,0.911035
154321,"Look at this fucking piece of statist, boot licking bigoted shit! The Goddess of Death would feel much safer with the 6 black people in hoodies than she would ever feel around just ONE cop! Fuck, She'd offer to buy them their coffee and ask if they'd like to sit with Her!",0.57150364,0.13815513,0.52891463,0.7775208,0.8802007,0.9248995
16616,send me shit now you braindead motherfuckers,0.37432748,0.13717735,0.60344857,0.89108896,0.96028095,0.9817629
134012,MAGAhats are the dumbest pieces of shit on the planet.,0.36942887,0.011508608,0.35368225,0.8579266,0.83974665,0.9248995
132116,bitches be like “i want to be best friends with jk.” thats me. i’m bitches,0.3817989,0.012751401,0.35368225,0.7492263,0.8802007,0.91625386
31318,no one: capri: what if mika FUCKED the SHIT out of yuus ass,0.099072486,0.122295745,0.50703704,0.5130944,0.8326356,0.9029226
14249,is a fucking moron. What’s the problem?,0.109318495,0.010654188,0.44969136,0.8987166,0.91513264,0.9563754
4921,"LOVE PRESIDENT TRUMP! Best President EVER!! You can eat shit, idiot!",0.06340405,0.035458352,0.35368225,0.87506694,0.85672,0.9209984
49220,Your best shit ain’t better than my worst shit,0.06476828,0.011715741,0.35368225,0.56997263,0.8949436,0.91625386
3013,taystee needs to shoot this motherfuckeeeeer... it’s what he deserves!,0.13591312,0.70778835,0.51028454,0.65129566,0.7466957,0.90451443
53414,"You shouldn't have went airborne. No one should, that shit is horrible for your knees and back. Also, those dudes can fuck off.",0.10235514,0.056240413,0.35368225,0.6099415,0.90258646,0.911035
13687,GROW THE FUCK UP. the world doesn't revolve around you and your beliefs,0.1444726,0.06690872,0.47416782,0.67735565,0.89909166,0.93383175
124110,an utterly shit lawyer or wilfully stupid. Got to be one or other.,0.13163337,0.010680079,0.34935045,0.8502231,0.8326356,0.91625386
170015,the level of infatuation i have for this bitch,0.18235919,0.021645326,0.35094213,0.755201,0.8449782,0.91625386
4015,Fuck I hate the trans community.,0.8330005,0.039256934,0.45895407,0.6109131,0.85672,0.944597
63220,"F*ck you... your boy, Bernie called 65% of the country “stupid.”",0.15731181,0.025443908,0.45895407,0.8032227,0.84506536,0.9391453
60910,"The audacity! Tomi, you're as big a fucking embarrassment as your leader! Fuck off!",0.15517195,0.04233929,0.51028454,0.83943826,0.90150756,0.95048624
60922,Y’all suck for making jokes about abortions and killing babies cause y’all wanna enjoy y’all summer. Real ppl out here that gotta go through that shit. And y’all joke.,0.28034934,0.44942492,0.460081,0.71120167,0.83974665,0.9288007
9677,Yes I mad. I am so fucking sick of the gay jihad against the rest of us. Gays are not the center of the fucking universe like they think they are,0.7895903,0.033386398,0.45895407,0.6308392,0.86331284,0.911035
9039,"This is some pathetic shit, dude. Absolutely pathetic. Not surprised, though... look at the hashtag you have. Disgusting human, you are.",0.17070955,0.026307223,0.45895407,0.8502231,0.844891,0.9391453
83017,"what the fuck is your fucking problem? you’re so negative about everything and you always have something to say about what i do, i fucking hate friends like this. 🖕🏽",0.19890837,0.05171447,0.53082085,0.67254376,0.90150756,0.96069145
2417,Y’all this parenting shit not hard at all y’all be over exaggerating tf out of this shit,0.1064171,0.023199292,0.45895407,0.6261769,0.8855216,0.93383175
1367,wont shit stop me from callin a bitch ah shwebb lmao iont curr,0.2308735,0.051391184,0.45895407,0.6099415,0.8690192,0.9061063
10310,yeah im a fucking dumbass what about it,0.058856625,0.011172019,0.35368225,0.65129566,0.91513264,0.9061063
10315,you domme a beginner into learning console commands or something? or theyre talking about learning assembly and they type out 01000101,0.033011556,0.021645326,0.35368225,0.6099415,0.91513264,0.9288007
65413,The fucking whore also didn't remove me from FB even after this,0.19298288,0.030623792,0.51028454,0.78882504,0.9421618,0.96069145
65417,But actually lmao fuck outta here lmao,0.06476828,0.030969119,0.44787344,0.50440645,0.86331284,0.90451443
85023,"Your team hasn't qualified since 2007, think about bthat you jihadi shit .I pity pakis since they have people like you to emulate. Shameless slut",0.60238177,0.122295745,0.52891463,0.8634578,0.84995824,0.9288007
5691,Im ready to eat you and fuck you,0.10221587,0.54744303,0.50703704,0.5678696,0.8802007,0.9391453
63417,Every bitch that ever told me I’m ugly you capped and for that you should die 🤝🤷‍♂️,0.293411,0.6943677,0.51028454,0.7065844,0.6321197,0.90451443
160313,Fuck off psycho kangana and her ignorant bots,0.293411,0.07399795,0.5145575,0.78882504,0.8855216,0.9391453
87622,"Congratulations you piece of shit, I still think about you.",0.10221587,0.011146127,0.3529199,0.7922567,0.8907955,0.9061063
12481,Scum? You are scum mixed bastard.,0.19100772,0.011508608,0.4195425,0.88346136,0.7673477,0.9209984
124813,Shut the fuck up you arrogant piece of shit. Go get another degree and stay in your fuckin bubble.,0.27171627,0.12536226,0.6134631,0.9263389,0.95876634,0.9749944
12696,I too would love an update. Fuck that bitch up haha.,0.07425626,0.085497424,0.44787344,0.7344449,0.9421618,0.93383175
126920,can this girl just shut the fuck up alrdy,0.16587129,0.08089764,0.45895407,0.65129566,0.84995824,0.9209984
168821,This piece of shit should be thankful that's not my mother.,0.10221587,0.011146127,0.35368225,0.7762574,0.90150756,0.9209984
10913,These Indian commentators talk so much shit,0.6007182,0.01750142,0.35368225,0.6308392,0.8117245,0.911035
3767,movie theatre chain Cineplex eat my ass,0.09659086,0.053007595,0.35368225,0.46774593,0.7888968,0.9061063
476,What the fuck? Lmao. Bitch there is only ot7. No such thing as ot6 in BTS.,0.1508922,0.019228047,0.48355904,0.6500014,0.9205162,0.9563754
10416,Now fuck off back to /soc/ and stop posting photos of yourself,0.06749674,0.056240413,0.46477664,0.58196646,0.8949436,0.9288007
104121,You are such a liar. Racist fool ...,0.17303948,0.013165667,0.22207877,0.89108896,0.38845423,0.9029226
12751,&amp; now you a opp to me you fuckin with opps now don’t even know the bitch 😂,0.13163337,0.04363242,0.45895407,0.6336687,0.84995824,0.91625386
5326,"OMG you are the ONLY president EVER to sit on fucking Twitter ALL day and Tweet stupid shit...go play golf at least there you're not a fucking ticking time bomb, you orange baboon!",0.24150419,0.09009721,0.52737635,0.8204276,0.8907955,0.9391453
715,black hebrews calls the Holocaust a joke and applauds hitler,0.55044734,0.11922921,0.52891463,0.8502231,0.8186401,0.9209984
22023,9. The entire arsenal? you are a fucking faggot lier,0.6106996,0.063352615,0.52891463,0.8987166,0.9205162,0.96426713
52915,Not a matter of whether it helps her personally you fucking dummy. These people rant about how hard done to AAs are and then slag off the man who has done the most for them in the last decade. It's all about virtue signalling with u fuckers. U don't actually give a fuck.,0.11047905,0.13363713,0.45895407,0.7782364,0.902047,0.9209984
119216,I got the same treatment for calling a C#*t... Fuckin pussies can't handle the truth! 🤣,0.17459276,0.01750142,0.45895407,0.7065844,0.902047,0.911035
1265,You fucking sack of human waste,0.28034934,0.045895394,0.5344867,0.87225974,0.927271,0.96426713
100916,Bitch when the fuck where u arrested?? We need to talk when ur home.,0.10221587,0.13734594,0.45895407,0.7967344,0.90258646,0.9391453
10611,Bitch shut up cause you ain’t shooting a SOUL literally !,0.14019285,0.3993542,0.45895407,0.7497506,0.776286,0.91625386
97215,Vegans are fucking morons. So much facepalm I can't take it. Excuse me while I go kill a few squirrels to balance out the universe.,0.6458014,0.54310024,0.52737635,0.8032227,0.89909166,0.95048624
162621,"Shit negro, that's all you had to say",0.82739437,0.060443077,0.45895407,0.7827088,0.84506536,0.9248995
137814,"U CRAZY IMMATURE BABY STUPID CHILDISH TRAITOR YOU ARE INEPT AND DESTROYING AMERICA AND DEMOCRACY AND ""LOCK EVIL TRUMF UP"" WORST PRESIDENT EVER MICHELLE OBAMA =SMART &amp; BEAUTIFUL MALANIA =BREAST IMPLANTS &amp;DUMB &amp;RACIST &amp;ILLEGAL IMMIGRANT &amp;CHAIN MIGRATION TOAD OF SON OBAMA=BEST",0.47178617,0.13262562,0.50703704,0.8987166,0.541926,0.9288007
10777,jc has the ugliest pictures of me FUCK LMFAOOOO.,0.10221587,0.04363242,0.45895407,0.5239335,0.8255558,0.9248995
74712,You are STILL so fucking retarded it hurts. Get a clue.,0.36702603,0.024062606,0.52891463,0.87225974,0.90862066,0.9563754
90919,No more fucking niggas bitches @additupcuello and everybody keep telling me that's going to be my downfall lol,0.84706575,0.13815513,0.56375664,0.802824,0.8949436,0.944597
64223,Threat? Fucking Hell. Our milkman threatened to leave us some milk this morning. Bastard.,0.10221587,0.1366716,0.45895407,0.78882504,0.90258646,0.9288007
75911,“stop airing the homie out” FUCK YO HOMIE NIGGA,0.7895903,0.063352615,0.49764585,0.7775208,0.8802007,0.93383175
75917,Following all fellow patriots! #MAGA2020 #KAG2020,0.14233272,0.0103175985,0.35112193,0.7090544,0.8690192,0.9061063
3611,"Hey, bear fucker... Do you need assistance?",0.07425626,0.012958534,0.36435235,0.71120167,0.8690192,0.9029226
36116,Real reason Swede so rich is because its 95% white,0.13805299,0.0138755,0.34927294,0.7762574,0.8449782,0.9061063
158412,Baby father back on that bullshit,0.037909906,0.014220826,0.23225488,0.48627716,0.8907955,0.90451443
147316,I’m about to drag Makayla for the stupid bitch that she is,0.21668483,0.52547425,0.44860926,0.8032227,0.776286,0.9061063
132220,Politely tell him to go fuck himself and that he is not getting shit,0.07921951,0.2836219,0.45895407,0.5935568,0.8907955,0.9248995
97817,Fuckin clown for this one chief,0.06658725,0.016638106,0.35368225,0.72756535,0.8855216,0.9029226
157917,But you suck dick ain’t it?,0.06158508,0.019055385,0.457266,0.48627716,0.83974665,0.90451443
52517,the jews and reptillians control the media!,0.2839175,0.013702838,0.39194742,0.8082062,0.8802007,0.9209984
83414,IS THE BIGGEST PILE OF SHIT EVER WITH NO CONTACT NUMBER?????!??!!?!????!!!! Better sort this fucking out!! Next day delivery since SATURDAY are u having a laugh! Like are u actually?? need to sort this out someone does I’m sick of talking to robots!!,0.078392304,0.058826666,0.5843659,0.6308392,0.85672,0.944597
147218,GET OFF ME YOU FUCKING BEAST! THIS IS RAPE!,0.28034934,0.49142194,0.61260825,0.6991143,0.8690192,0.9288007
100312,Im real not here as fuck for the bullshit so take yo message and talk to my block button 😂goofy ass,0.17303948,0.094697006,0.52891463,0.71551245,0.90258646,0.9563754
33911,I don’t want to be here at this stupid ass job. These hoes weird,0.28034934,0.016810767,0.35368225,0.755201,0.844891,0.9288007
33916,"When caught in a lie, blame someone else",0.105836816,0.064645745,0.45895407,0.69164425,0.902047,0.9391453
119619,OH FUCK INSECURITIES ITS RUINING MY WHOLE SYSTEM AGAIN,0.04280826,0.022163315,0.44787344,0.37052566,0.87472564,0.9029226
57819,Please come and fuck my life.... and me,0.035589635,0.18281023,0.45895407,0.4196762,0.8949436,0.9248995
78119,LMAOOOO i fucking hate y’all .,0.35624164,0.079364374,0.45895407,0.62169385,0.8117245,0.9288007
13656,"We already have socialism, dumb ass.",0.21866,0.0113014765,0.23225145,0.7775208,0.79449326,0.90451443
126012,You think a follow count matters I have more earnings than you. Fucking shitting ass keyboard player get off my feed.,0.10221587,0.022681303,0.45895407,0.72756535,0.927271,0.9563754
12769,You’re fucking autistic if you legit think the Jonas Brothers don’t get hella pussy lmao. They are chads.,0.44690517,0.05171447,0.49764585,0.6675394,0.8086746,0.9209984
13496,razeeq i hate you i hope you get suspended again fuck that video is disgusting,0.2949366,0.34804323,0.54893947,0.6675394,0.80158395,0.9563754
8988,"Shut the fuck up already, MacDegenerate.",0.10221587,0.06658544,0.45895407,0.7657292,0.90150756,0.9288007
1109,Bitches talk big shit on social media but when you see them they be quiet,0.36702603,0.035803676,0.44787344,0.7775208,0.8949436,0.9248995
132523,"Seriously, what a fuckin timid little faker of a faggot, disgraceful,....swamp plug sessions what I call him",0.6007182,0.13815513,0.52891463,0.8390655,0.84995824,0.9288007
50414,You put ur hands on me fuck nigga u goin to jail.. im light skin i bruise easy an i never seen no nigga hit my momma or grandma bitch go tf to JAILLLLLLLLLLLLL n stop playin with a real bitch,0.7426507,0.44942492,0.61260825,0.802824,0.8690192,0.95048624
129311,WHAT OTHER FREAKS HAVE CHOKING PEOPLE AS A REACTION MEME BITCH WHO,0.2869935,0.2836219,0.45895407,0.71027446,0.7809412,0.90451443
129321,Bitch yah work hard fi a block. Is you mad?,0.10221587,0.021472665,0.35368225,0.75027496,0.7809412,0.9029226
11197,Niggas tryna force bullshit in my ear,0.7895903,0.063352615,0.39194742,0.6831271,0.85672,0.91625386
137422,wheelchair bound ass bitch,0.25986546,0.034422375,0.45895407,0.7775208,0.90150756,0.9391453
137423,Yes I know. That woman is an idiot.,0.44690517,0.0089712385,0.16960317,0.9063489,0.5188411,0.91625386
136915,"""own it now"" bitch I'm poor stfu",0.18002926,0.030969119,0.457266,0.7492263,0.8802007,0.9209984
12456,This is just fucking ridiculous man.,0.062039822,0.009566744,0.35368225,0.6500014,0.90862066,0.9248995
50012,Even Confederate slave owners fucked black girls,0.7499929,0.055270568,0.44787344,0.6149945,0.8449782,0.9209984
98914,WTF.. yo fuck arrested.. somebody need to cut that nigga tongue out,0.8182097,0.6615786,0.56375664,0.7827088,0.8690192,0.95048624
133320,I actually shit myself a little fuck you,0.055673428,0.13566011,0.45895407,0.6308392,0.9342644,0.95048624
48714,cancelling 3 days before the event? fuck you @Rockstardisrupt,0.054763943,0.064645745,0.44787344,0.5739874,0.844891,0.9029226
9228,"FUCK ALL YOU MOTHERFUCKERS WHO GET ON WITH THE ""GOOD BLACKS",0.7937624,0.13532294,0.6224206,0.84251964,0.9540331,0.9817629
8621,What a fucking sick piece of filth.,0.10221587,0.012906751,0.45895407,0.7922567,0.90862066,0.95048624
86220,Quit tryna cheat and do your own shit,0.04667538,0.016638106,0.30192792,0.5739874,0.8802007,0.9029226
29821,Just look at this motherfucker.........,0.05089863,0.018364733,0.45895407,0.78882504,0.9205162,0.9563754
140916,All the old white bitches on the money group are stupid af. That group ain’t even fun to be in anymore.,0.7426507,0.035803676,0.457266,0.8012121,0.79449326,0.9061063
2112,seriously all these little bitches that disrespected MY country's flag should be charged with treason - disrespectful little cunts - your victory is shit and you disgrace your teammates and your country,0.39207554,0.18913531,0.52891463,0.802824,0.7809412,0.9061063
12668,Now shut the fuck up. You can't fix the fatties. All you can do is stop the kids from becoming fatties.,0.38215697,0.05042134,0.45895407,0.69164425,0.8690192,0.9209984
167112,youre fucking joking . youre literally fuxking joking oh my god i HATE YOU KCON,0.2028587,0.06626215,0.5583572,0.71027446,0.8802007,0.9563754
24515,Fucking idiot gives me wrong meal,0.10221587,0.015256803,0.45895407,0.9028068,0.9342644,0.968226
148619,fuckkkkkkkkk!😂😂😂😂 he bout to take a bite out of crime. big ass teeth,0.09328204,0.13448004,0.45895407,0.46774593,0.7785769,0.90451443
10965,Wtf is wrong with y'all spitting and licking food in the grocery store or in a restaurant??? Like who tf raised y'all animals.? Y'all mad trifling like I don't understand what is entertaining or funny about that nasty shit. People just the worst.,0.14233272,0.032005094,0.457266,0.68668073,0.8086746,0.90451443
166414,People are fucking dumb! And they deserve life in jail for bejng social media clout chasers,0.23163283,0.3077799,0.44787344,0.8032227,0.8255558,0.911035
9129,me when fucking k rool keeps edgeguarding like a little bitch,0.13163337,0.014393489,0.44787344,0.71027446,0.9421618,0.9391453
91216,This bitch live FAR as hell bro,0.22631748,0.038220957,0.4379392,0.7804726,0.844891,0.9209984
67018,"He simply scoffs with a smile. “ You really are . . . Pathetic. “ The Aristocrat nods. It was a surprise the lady even recognized the other to be a rich person. Even yelling at him for being a huge brat because of it. “ Clearly, you do not even like what you’re +",0.19495805,0.03235042,0.35368225,0.8634578,0.77181685,0.91625386
91320,"You are a moron &amp; embarrassment &amp; can assume all foreign diplomats know this as you’ve proved it on the world stage. I say this as a common citizen of the USA; you’re an inept clown and Putin’s puppet, liar, fraud, con, sexual predator, racist, xenophobe, traitor &amp; now pedophile",0.41052565,0.07399795,0.45895407,0.87225974,0.570067,0.90451443
5461,You are nothing short of a cunt,0.09080041,0.00951496,0.35368225,0.8082062,0.8089582,0.911035
16867,I just don't want you fucking stormfaggots to shove worship of Germany down my throat.,0.6649212,0.13650303,0.49295026,0.75027496,0.8949436,0.9209984
